name,datetime,tempmax,tempmin,temp,feelslikemax,feelslikemin,feelslike,dew,humidity,precip,precipprob,precipcover,preciptype,snow,snowdepth,windgust,windspeed,winddir,sealevelpressure,cloudcover,visibility,solarradiation,solarenergy,uvindex,severerisk,sunrise,sunset,moonphase,conditions,description,icon,stations
"Washington,DC,USA",1/1/21,40.8,35.9,37.6,34.8,28.7,31.8,30.3,75.8,0.81,100,41.67,rain,0,0,20.8,16.2,30.4,1027.8,99.6,8.3,12.8,1.2,1,,2021-01-01T07:26:54,2021-01-01T16:57:05,0.53,"Rain, Overcast",Cloudy skies throughout the day with rain.,rain,"KDCA,72405013743,72403793728,KADW,KDAA,F8307,74594013705"
"Washington,DC,USA",1/2/21,56.9,37,44.9,56.9,31.5,41.9,39,81.2,0,0,0,,0,0,26.4,14,326.8,1015.2,89.8,8.4,38.1,3.4,2,,2021-01-02T07:27:01,2021-01-02T16:57:55,0.56,Partially cloudy,Partly cloudy throughout the day.,partly-cloudy-day,"KDCA,72405013743,72403793728,KADW,KDAA,F8307,74594013705"
"Washington,DC,USA",1/3/21,43,38.9,40.6,42.7,31.8,35.9,37.1,87.7,0.28,100,29.17,rain,0,0,,11.3,2.9,1015.8,98.4,8.5,12.3,1,0,,2021-01-03T07:27:05,2021-01-03T16:58:46,0.6,"Rain, Overcast",Cloudy skies throughout the day with a chance of rain throughout the day.,rain,"KDCA,72405013743,72403793728,KADW,KDAA,F8307,74594013705"
"Washington,DC,USA",1/4/21,46.1,34.7,40.5,44,29.8,36.9,34.2,78.8,0,0,0,,0,0,,9.8,334,1016.1,81,9.6,37.8,3.1,2,,2021-01-04T07:27:07,2021-01-04T16:59:39,0.65,Partially cloudy,Partly cloudy throughout the day.,partly-cloudy-day,"KDCA,72405013743,72403793728,KADW,KDAA,F8307,74594013705"
"Washington,DC,USA",1/5/21,42.8,39.6,40.9,41.8,32.4,37.3,35,79.3,0.03,100,4.17,rain,0,0,,12.3,315.8,1014.4,99.5,9.7,16.5,1.3,1,,2021-01-05T07:27:07,2021-01-05T17:00:33,0.7,"Rain, Overcast",Cloudy skies throughout the day with afternoon rain.,rain,"KDCA,72405013743,72403793728,KADW,KDAA,F8307,74594013705"
"Washington,DC,USA",1/6/21,42.9,38.6,40.5,35.3,32.3,33.3,28.9,63.4,0,0,0,,0,0,30.9,21.3,320.1,1020,99.4,9.9,22.9,2.1,1,,2021-01-06T07:27:05,2021-01-06T17:01:29,0.76,Overcast,Cloudy skies throughout the day.,cloudy,"KDCA,72405013743,72403793728,KADW,KDAA,F8307,74594013705"
"Washington,DC,USA",1/7/21,46.9,33.8,39.7,42.4,26.4,33.3,26.1,58.8,0,0,0,,0,0,31.8,19.3,329.5,1021.9,47.6,9.9,73.8,6.5,4,,2021-01-07T07:27:00,2021-01-07T17:02:25,0.82,Partially cloudy,Partly cloudy throughout the day.,partly-cloudy-day,"KDCA,72405013743,72403793728,KADW,KDAA,F8307,74594013705"
"Washington,DC,USA",1/8/21,37.9,33.8,35.6,34.3,24.9,29.3,24.2,63.2,0,0,0,,0,0,,13.4,351.8,1016.4,88.6,9.9,25.3,2.1,2,,2021-01-08T07:26:54,2021-01-08T17:03:23,0.87,Partially cloudy,Partly cloudy throughout the day.,partly-cloudy-day,"KDCA,72405013743,72403793728,KADW,KDAA,F8307,74594013705"
"Washington,DC,USA",1/9/21,46.9,31.8,38.4,39.7,21.1,29.9,18.1,45,0,0,0,,0,0,32.4,20.2,337.3,1015.3,51.5,9.9,75.1,6.5,4,,2021-01-09T07:26:45,2021-01-09T17:04:22,0.92,Partially cloudy,Partly cloudy throughout the day.,partly-cloudy-day,"KDCA,72405013743,72403793728,KADW,KDAA,F8307,74594013705"
"Washington,DC,USA",1/10/21,48.7,34.9,40.6,45.2,28.5,36.2,22.9,50.3,0,0,0,,0,0,27.5,13.8,319.3,1024.2,22.2,9.9,74.9,6.4,4,,2021-01-10T07:26:34,2021-01-10T17:05:22,0.96,Partially cloudy,Partly cloudy throughout the day.,partly-cloudy-day,"KDCA,72405013743,72403793728,KADW,KDAA,F8307,74594013705"
"Washington,DC,USA",1/11/21,43.1,29.2,36.3,39.7,27.5,34.4,27.8,71.5,0,0,0,,0,0,,7.9,194.5,1025.3,78.7,9.9,31.8,2.8,2,,2021-01-11T07:26:21,2021-01-11T17:06:23,0.99,Partially cloudy,Partly cloudy throughout the day.,partly-cloudy-day,"KDCA,72405013743,72403793728,KADW,KDAA,F8307,74594013705"
"Washington,DC,USA",1/12/21,48.8,29.3,37.2,46,24.4,35.6,27.8,71.6,0,0,0,,0,0,,8.8,309.6,1021.4,27.4,9.4,69.8,6.1,3,,2021-01-12T07:26:06,2021-01-12T17:07:24,1,Partially cloudy,Partly cloudy throughout the day.,partly-cloudy-day,"KDCA,72405013743,72403793728,KADW,KDAA,F8307,74594013705"
"Washington,DC,USA",1/13/21,50.1,30.2,39.1,50.1,25.5,37.8,30,71.2,0,0,0,,0,0,,9.8,191.7,1017.1,38.6,9.7,71.3,6.2,3,,2021-01-13T07:25:49,2021-01-13T17:08:27,0,Partially cloudy,Partly cloudy throughout the day.,partly-cloudy-day,"KDCA,72405013743,72403793728,KADW,KDAA,F8307,74594013705"
"Washington,DC,USA",1/14/21,55.1,31.4,41.7,55.1,31.4,41.3,29.8,67.1,0,0,0,,0,0,,12.2,7.6,1010.6,48.4,8.9,70.6,6.3,4,,2021-01-14T07:25:30,2021-01-14T17:09:30,0.01,Partially cloudy,Partly cloudy throughout the day.,partly-cloudy-day,"KDCA,72405013743,72403793728,KADW,KDAA,F8307,74594013705"
"Washington,DC,USA",1/15/21,52,34.7,43.3,52,27.4,40.3,36.3,77,0.17,100,16.67,rain,0,0,23,14.4,109.5,1009.4,91.5,9,45.7,3.8,3,,2021-01-15T07:25:09,2021-01-15T17:10:34,0.03,"Rain, Overcast",Cloudy skies throughout the day with late afternoon rain.,rain,"KDCA,72405013743,72403793728,KADW,KDAA,F8307,74594013705"
"Washington,DC,USA",1/16/21,46.9,37.7,42.3,45.9,31.2,36.9,30.8,65.3,0,0,0,,0,0,31.1,14.1,289.7,1001.9,60.9,9.8,58.3,5.1,3,,2021-01-16T07:24:45,2021-01-16T17:11:39,0.06,Partially cloudy,Partly cloudy throughout the day.,partly-cloudy-day,"KDCA,72405013743,72403793728,KADW,KDAA,F8307,74594013705"
"Washington,DC,USA",1/17/21,48.6,33.7,40.4,43.3,26.6,34.7,26.1,57.1,0,0,0,,0,0,23,13.4,226,1007.9,81.2,9.9,52.8,4.5,3,,2021-01-17T07:24:20,2021-01-17T17:12:45,0.1,Partially cloudy,Partly cloudy throughout the day.,partly-cloudy-day,"KDCA,72405013743,72403793728,KADW,KDAA,F8307,74594013705"
"Washington,DC,USA",1/18/21,45.9,34.7,39.9,39.9,30.7,34.7,23.5,53.7,0,0,0,,0,0,30.7,17.3,269,1011.9,74.4,9.9,57.4,5.1,3,,2021-01-18T07:23:53,2021-01-18T17:13:51,0.14,Partially cloudy,Partly cloudy throughout the day.,partly-cloudy-day,"KDCA,72405013743,72403793728,KADW,KDAA,F8307,74594013705"
"Washington,DC,USA",1/19/21,52,33.7,41.1,52,28.8,37.3,20.1,45.2,0,0,0,,0,0,30.6,16.1,243.7,1020.8,60.9,9.9,75.2,6.5,4,,2021-01-19T07:23:23,2021-01-19T17:14:58,0.19,Partially cloudy,Clearing in the afternoon.,partly-cloudy-day,"KDCA,72405013743,72403793728,KADW,KDAA,F8307,74594013705"
"Washington,DC,USA",1/20/21,44.8,31.6,38.8,39.5,26.1,32.7,21.8,51.5,0,0,0,,0,0,47.3,27.1,301.6,1017.8,72.7,9.9,66,5.6,3,,2021-01-20T07:22:52,2021-01-20T17:16:05,0.23,Partially cloudy,Partly cloudy throughout the day.,partly-cloudy-day,"KDCA,72405013743,72403793728,KADW,KDAA,F8307,74594013705"
"Washington,DC,USA",1/21/21,53.9,26.7,39.9,53.9,21.2,35.9,23.6,54.1,0,0,0,,0,0,,13.5,203.6,1010,34.9,9.9,79.6,6.9,4,,2021-01-21T07:22:18,2021-01-21T17:17:12,0.28,Partially cloudy,Clearing in the afternoon.,partly-cloudy-day,"KDCA,72405013743,72403793728,KADW,F8307,74594013705"
"Washington,DC,USA",1/22/21,49.9,32.9,41.3,45.1,27.5,35.8,23.3,51.3,0,0,0,,0,0,31.1,19.4,293.2,1010.3,27.6,9.9,84.5,7.3,4,,2021-01-22T07:21:43,2021-01-22T17:18:20,0.33,Partially cloudy,Becoming cloudy in the afternoon.,partly-cloudy-day,"KDCA,72405013743,72403793728,KADW,F8307,74594013705"
"Washington,DC,USA",1/23/21,39.6,26.9,33.1,31.8,14.3,22.8,10.6,39.2,0,0,0,,0,0,36.2,22,320.8,1022.6,37.9,9.8,84.5,7.4,4,,2021-01-23T07:21:05,2021-01-23T17:19:29,0.37,Partially cloudy,Clearing in the afternoon.,partly-cloudy-day,"KDCA,72405013743,72403793728,KADW,F8307,74594013705"
"Washington,DC,USA",1/24/21,37,26,31.7,37,15.5,25.9,12.6,45.3,0,0,0,,0,0,16.1,11.5,313.7,1025.4,81.8,9.9,69.1,6,4,,2021-01-24T07:20:26,2021-01-24T17:20:38,0.41,Partially cloudy,Partly cloudy throughout the day.,partly-cloudy-day,"KDCA,72405013743,72403793728,KADW,KDAA,F8307,74594013705"
"Washington,DC,USA",1/25/21,38.8,31.9,35.9,35.7,24.4,31.2,23.6,61.8,0.18,100,25,"rain,snow",0,0,,10,66,1019.6,99.3,8.8,20.6,1.8,1,,2021-01-25T07:19:45,2021-01-25T17:21:47,0.44,"Snow, Rain, Overcast",Cloudy skies throughout the day with late afternoon rain or snow.,rain,"KDCA,72405013743,72403793728,KADW,KDAA,F8307,74594013705"
"Washington,DC,USA",1/26/21,38,31.9,34.9,37.1,23.8,31.3,33.2,93.4,0.07,100,25,"rain,snow",0,0,,9.7,38.9,1013.6,98.6,3.5,20.3,1.6,1,,2021-01-26T07:19:02,2021-01-26T17:22:56,0.47,"Snow, Rain, Overcast",Cloudy skies throughout the day with a chance of rain or snow throughout the day.,rain,"KDCA,72405013743,72403793728,KADW,KDAA,F8307,74594013705"
"Washington,DC,USA",1/27/21,43,35.8,39.4,37.7,26.4,33.5,30.2,71.2,0,0,0,,0,0,25.3,16.9,333,1018.2,94.1,8.7,52.1,4.7,3,,2021-01-27T07:18:17,2021-01-27T17:24:05,0.49,Overcast,Cloudy skies throughout the day.,cloudy,"KDCA,72405013743,72403793728,KADW,KDAA,F8307,74594013705"
"Washington,DC,USA",1/28/21,35.9,28,32.6,28.5,15.7,21,13.7,45.8,0,0,0,,0,0,42.6,27.1,333.5,1023,61.3,9.9,86.7,7.4,4,,2021-01-28T07:17:31,2021-01-28T17:25:15,0.5,Partially cloudy,Clearing in the afternoon.,partly-cloudy-day,"KDCA,72405013743,72403793728,KADW,KDAA,F8307,74594013705"
"Washington,DC,USA",1/29/21,33,24.9,28.8,22.1,10.6,17.2,8.1,41.2,0,0,0,,0,0,37.7,24.8,316.2,1026,70.2,9.9,54.3,5,2,,2021-01-29T07:16:42,2021-01-29T17:26:25,0.51,Partially cloudy,Partly cloudy throughout the day.,partly-cloudy-day,"KDCA,72405013743,72403793728,KADW,KDAA,F8307,74594013705"
"Washington,DC,USA",1/30/21,38.7,23.8,31.1,37.8,15.1,24.9,12,45.1,0,0,0,,0.8,0.2,18.3,13.3,290.1,1027.7,52.9,9.9,97.3,8.7,4,,2021-01-30T07:15:52,2021-01-30T17:27:35,0.52,Partially cloudy,Becoming cloudy in the afternoon.,snow,"KDCA,72405013743,72403793728,KADW,KDAA,F8307,74594013705"
"Washington,DC,USA",1/31/21,33.8,29.8,31.5,32,20.7,24.6,26.7,83.7,0.45,100,62.5,"rain,snow",1.3,1.1,,14.8,72.5,1021.2,95.1,3.5,9.4,0.8,0,,2021-01-31T07:15:00,2021-01-31T17:28:45,0.54,"Snow, Rain, Overcast",Cloudy skies throughout the day with a chance of rain or snow throughout the day.,snow,"KDCA,72405013743,72403793728,KADW,KDAA,F8307,74594013705"
"Washington,DC,USA",2/1/21,33.9,29.1,31.5,27.4,17.3,21.2,28.4,88.1,0.17,100,29.17,"rain,snow",0.8,2.1,34.4,19.2,342.1,1008.4,99.5,5.8,20.5,1.7,1,,2021-02-01T07:14:07,2021-02-01T17:29:54,0.59,"Snow, Rain, Overcast",Cloudy skies throughout the day with rain or snow.,snow,"KDCA,72405013743,72403793728,KADW,KDAA,F8307,74594013705"
"Washington,DC,USA",2/2/21,36.9,32,34.2,27,21,23.9,26.9,75.2,0.15,100,37.5,"rain,snow",0.2,2.4,44.1,22.4,321.7,1002.4,99.4,6.5,37.8,3.2,2,,2021-02-02T07:13:12,2021-02-02T17:31:04,0.63,"Snow, Rain, Overcast",Cloudy skies throughout the day with rain or snow clearing later.,snow,"KDCA,72405013743,72403793728,KADW,KDAA,F8307,74594013705"
"Washington,DC,USA",2/3/21,42,31.9,36.4,35,21.3,27.3,22.9,58.3,0,0,0,,0.5,1.6,36,22.4,313.4,1005.6,76.1,9.9,61.1,5.3,3,,2021-02-03T07:12:15,2021-02-03T17:32:14,0.68,Partially cloudy,Partly cloudy throughout the day.,snow,"KDCA,72405013743,72403793728,KADW,KDAA,F8307,74594013705"
"Washington,DC,USA",2/4/21,49.7,30.6,38.4,48,22.5,33.1,14.8,39.2,0,0,0,,1.1,1.4,28.6,16.5,292.7,1014.6,38.3,9.9,104.4,9,5,,2021-02-04T07:11:17,2021-02-04T17:33:24,0.74,Partially cloudy,Partly cloudy throughout the day.,snow,"KDCA,72405013743,72403793728,KADW,KDAA,F8307,74594013705"
"Washington,DC,USA",2/5/21,55.8,38,45.7,55.8,30.2,41,27.6,51.4,0.07,100,8.33,rain,0.8,1.1,30.7,16.5,230.1,1006.8,71.1,9.9,107.7,9.1,5,,2021-02-05T07:10:17,2021-02-05T17:34:34,0.8,"Rain, Partially cloudy",Partly cloudy throughout the day with rain or snow clearing later.,snow,"KDCA,72405013743,72403793728,KADW,KDAA,F8307,74594013705"
"Washington,DC,USA",2/6/21,51.1,33.7,42.4,51.1,27.7,38.7,23,47.3,0,0,0,,0,0.1,25.2,15.9,237.5,1017.6,85.6,9.9,81.3,7,4,,2021-02-06T07:09:16,2021-02-06T17:35:43,0.85,Partially cloudy,Partly cloudy throughout the day.,partly-cloudy-day,"KDCA,72405013743,72403793728,KADW,KDAA,F8307,74594013705"
"Washington,DC,USA",2/7/21,43.5,31.6,38,43.5,25.2,32.2,28.3,70.4,0.5,100,45.83,"rain,snow",1.1,0.5,26.2,15.4,323.4,1015.9,78.4,8.4,37.2,3.3,3,,2021-02-07T07:08:13,2021-02-07T17:36:53,0.9,"Snow, Rain, Partially cloudy",Partly cloudy throughout the day with a chance of rain or snow throughout the day.,snow,"KDCA,72405013743,72403793728,KADW,KDAA,F8307,74594013705"
"Washington,DC,USA",2/8/21,38.8,25.7,30.9,32.8,15.5,23.9,12.6,46.6,0,0,0,,0,0.1,,14.1,60.9,1028.8,25,9.9,106.8,9.2,5,,2021-02-08T07:07:08,2021-02-08T17:38:02,0.94,Partially cloudy,Partly cloudy throughout the day.,partly-cloudy-day,"KDCA,72405013743,72403793728,KADW,KDAA,F8307,74594013705"
"Washington,DC,USA",2/9/21,50.1,30.4,39.1,50.1,23.9,35.3,27.9,64.8,0,0,0,,0,0,,14.2,11,1023.2,88,9.9,94.3,8.1,4,,2021-02-09T07:06:03,2021-02-09T17:39:11,0.97,Partially cloudy,Partly cloudy throughout the day.,partly-cloudy-day,"KDCA,72405013743,72403793728,KADW,KDAA,F8307,74594013705"
"Washington,DC,USA",2/10/21,42.1,33.7,36.9,40.7,26,32.6,28,71.3,0.15,100,25,"rain,snow",0,0,,9.5,66.5,1026.4,90.6,8.1,62.5,5.3,4,,2021-02-10T07:04:56,2021-02-10T17:40:20,1,"Snow, Rain, Overcast",Cloudy skies throughout the day with rain or snow.,rain,"KDCA,72405013743,72403793728,KADW,KDAA,F8307,74594013705"
"Washington,DC,USA",2/11/21,35.7,33,34.4,31.7,25.1,27.5,30.5,85.8,0.2,100,29.17,"rain,snow",0,0,,13.2,47.5,1023.8,99.2,6,16.8,1.4,1,,2021-02-11T07:03:47,2021-02-11T17:41:29,1,"Snow, Rain, Overcast",Cloudy skies throughout the day with rain or snow clearing later.,rain,"KDCA,72405013743,72403793728,KADW,KDAA,F8307,74594013705"
"Washington,DC,USA",2/12/21,31.9,28.9,30.5,27.4,18.9,23.3,20.3,65.5,0,0,0,,0,0,,13.2,42,1026.6,99.2,9.5,34.2,3,1,,2021-02-12T07:02:37,2021-02-12T17:42:37,0,Overcast,Cloudy skies throughout the day.,cloudy,"KDCA,72405013743,72403793728,KADW,KDAA,F8307,74594013705"
"Washington,DC,USA",2/13/21,30.7,28.8,30.1,25.3,18.7,21.5,23.1,75.8,0.42,100,37.5,"rain,snow",0,0,,13.2,28.8,1024,99.5,7.5,22.7,1.8,1,,2021-02-13T07:01:26,2021-02-13T17:43:45,0.02,"Snow, Rain, Overcast",Cloudy skies throughout the day with rain or snow.,snow,"KDCA,72405013743,72403793728,KADW,KDAA,F8307,74594013705"
"Washington,DC,USA",2/14/21,38,28.8,33.4,33.5,19.8,26.9,29,84.1,0,0,0,,0,0,,10.8,1.7,1023.7,99.6,6.7,48.3,4,2,,2021-02-14T07:00:14,2021-02-14T17:44:53,0.04,Overcast,Cloudy skies throughout the day.,cloudy,"KDCA,72405013743,72403793728,KADW,KDAA,F8307,74594013705"
"Washington,DC,USA",2/15/21,41,35.8,37.3,39.9,27.1,32,31.1,78.8,0.23,100,12.5,rain,0,0,,13.2,31,1020.4,99.6,7.5,41,3.7,2,,2021-02-15T06:59:01,2021-02-15T17:46:01,0.07,"Rain, Overcast",Cloudy skies throughout the day with late afternoon rain.,rain,"KDCA,72405013743,72403793728,KDAA,KADW,F8307,74594013705"
"Washington,DC,USA",2/16/21,44,29.8,37.9,40.7,19.4,32.4,31.4,79.1,0.73,100,25,rain,0,0,34,21,304.9,1009.3,93.1,8.5,38.2,3.3,2,,2021-02-16T06:57:46,2021-02-16T17:47:08,0.1,"Rain, Overcast",Cloudy skies throughout the day with early morning rain.,rain,"KDCA,72405013743,72403793728,KADW,KDAA,F8307,74594013705"
"Washington,DC,USA",2/17/21,36.9,26,30.5,36.9,14.1,23.5,11.9,46,0,0,0,,0.8,0.2,24.3,15.7,337.6,1028.7,72.3,9.9,106.6,9.2,5,,2021-02-17T06:56:30,2021-02-17T17:48:15,0.14,Partially cloudy,Partly cloudy throughout the day.,snow,"KDCA,72405013743,72403793728,KADW,KDAA,F8307,74594013705"
"Washington,DC,USA",2/18/21,31.9,27.9,29.7,23.6,19.4,21,23.9,80,0.4,100,33.33,"rain,snow",0.9,0.8,20.8,14.6,25.2,1026.7,98.8,5.9,21.2,2,2,,2021-02-18T06:55:14,2021-02-18T17:49:22,0.19,"Snow, Rain, Overcast",Cloudy skies throughout the day with a chance of rain or snow throughout the day.,snow,"KDCA,72405013743,72403793728,KADW,KDAA,F8307,74594013705"
"Washington,DC,USA",2/19/21,39.8,30.6,34,31.6,21.1,25.5,28.2,80,0.05,100,16.67,"rain,snow",0.3,1,28.9,20.8,341.7,1020.7,96.5,7.5,47.3,4,2,,2021-02-19T06:53:56,2021-02-19T17:50:28,0.24,"Snow, Rain, Overcast",Cloudy skies throughout the day with rain or snow clearing later.,snow,"KDCA,72405013743,72403793728,KADW,KDAA,F8307,74594013705"
"Washington,DC,USA",2/20/21,32.1,26.8,29.8,23,15.6,19.1,11.5,46.6,0,0,0,,0.5,1,34.4,20.8,314.1,1025.9,68.4,9.9,98.7,8.6,5,,2021-02-20T06:52:37,2021-02-20T17:51:34,0.28,Partially cloudy,Partly cloudy throughout the day.,snow,"KDCA,72405013743,F0198,KADW,F8307,74594013705"
"Washington,DC,USA",2/21/21,38,25.1,31.5,35.6,13.7,24.7,13.2,47.1,0,0,0,,0,0.9,,12.8,278.1,1034.6,50,9.9,128.8,11.1,5,,2021-02-21T06:51:17,2021-02-21T17:52:40,0.33,Partially cloudy,Partly cloudy throughout the day.,partly-cloudy-day,"KDCA,72405013743,72403793728,KADW,KDAA,F8307,74594013705"
"Washington,DC,USA",2/22/21,39.8,31.8,34.3,34.6,22.9,27.1,28.5,80,0.41,100,25,"rain,snow",0,0.1,25.3,14.7,187.9,1017.7,85.3,8.1,22.7,1.9,1,,2021-02-22T06:49:56,2021-02-22T17:53:46,0.38,"Snow, Rain, Partially cloudy",Partly cloudy throughout the day with rain or snow in the morning and afternoon.,rain,"KDCA,72405013743,72403793728,KADW,KDAA,F8307,74594013705"
"Washington,DC,USA",2/23/21,58.8,30.6,43.2,58.8,22.8,40,31.6,68.5,0.01,100,4.17,"rain,snow",0,0,38.1,21.4,247.8,1010.1,54.2,8.1,100,8.4,4,,2021-02-23T06:48:34,2021-02-23T17:54:51,0.42,"Snow, Rain, Partially cloudy",Partly cloudy throughout the day with morning rain or snow.,rain,"KDCA,72405013743,72403793728,KADW,KDAA,F8307,74594013705"
"Washington,DC,USA",2/24/21,59.3,32.7,47.3,59.3,28.4,46.6,31.5,57.3,0,0,0,,0,0,25.3,16.9,189.1,1015.6,43.7,9.9,143.6,12.4,5,,2021-02-24T06:47:11,2021-02-24T17:55:56,0.45,Partially cloudy,Clearing in the afternoon.,partly-cloudy-day,"KDCA,72405013743,72403793728,KADW,KDAA,F8307,74594013705"
"Washington,DC,USA",2/25/21,57.6,39,49.9,57.6,39,47.9,26.4,41.4,0,0,0,,0,0,38.3,25.1,326.5,1021,15.9,9.9,141.7,12.3,5,,2021-02-25T06:45:48,2021-02-25T17:57:00,0.48,Clear,Clear conditions throughout the day.,clear-day,"KDCA,72405013743,72403793728,KADW,KDAA,F8307,74594013705"
"Washington,DC,USA",2/26/21,50.9,37.8,43.3,50.9,32.2,39.6,26.7,55.3,0.14,100,16.67,rain,0,0,22.2,14.3,106.3,1029.7,86,9.5,88.6,7.8,4,,2021-02-26T06:44:23,2021-02-26T17:58:04,0.5,"Rain, Partially cloudy",Partly cloudy throughout the day with late afternoon rain.,rain,"KDCA,72405013743,72403793728,KADW,KDAA,F8307,74594013705"
"Washington,DC,USA",2/27/21,52.8,37.9,43.8,52.8,32.7,40.6,39.9,86.7,0.26,100,37.5,rain,0,0,19.7,10.7,314.8,1022.3,93.2,7.9,70.5,6.1,3,,2021-02-27T06:42:58,2021-02-27T17:59:08,0.5,"Rain, Overcast",Cloudy skies throughout the day with rain clearing later.,rain,"KDCA,72405013743,72403793728,KADW,KDAA,F8307,74594013705"
"Washington,DC,USA",2/28/21,47.7,44,45.9,46.9,41,44.3,43.9,92.9,0.73,100,62.5,rain,0,0,,10.1,90.5,1020.8,92.6,6.7,13.7,1.1,0,,2021-02-28T06:41:32,2021-02-28T18:00:12,0.51,"Rain, Overcast",Cloudy skies throughout the day with a chance of rain throughout the day.,rain,"KDCA,72405013743,72403793728,KADW,KDAA,F8307,74594013705"
"Washington,DC,USA",3/1/21,51,40.9,46.7,51,32.8,43.6,36.7,72.8,0.38,100,41.67,rain,0,0,36.9,21.8,301.4,1010.6,85.2,7.5,33.9,2.9,1,,2021-03-01T06:40:06,2021-03-01T18:01:15,0.53,"Rain, Partially cloudy",Partly cloudy throughout the day with a chance of rain throughout the day.,rain,"KDCA,72405013743,72403793728,KADW,KDAA,F8307,74594013705"
"Washington,DC,USA",3/2/21,45.7,30.7,37.8,43.2,20.3,30.9,14.6,39.4,0,0,0,,0,0,38.7,20.6,325,1023.7,28.3,9.9,149.2,13,6,,2021-03-02T06:38:38,2021-03-02T18:02:18,0.57,Partially cloudy,Partly cloudy throughout the day.,partly-cloudy-day,"KDCA,72405013743,72403793728,KADW,KDAA,F8307,74594013705"
"Washington,DC,USA",3/3/21,59.9,30.6,44.8,59.9,24.9,42.2,22.7,46.6,0,0,0,,0,0,23.8,16.9,233.8,1015.3,14.3,9.9,155.9,13.4,6,,2021-03-03T06:37:10,2021-03-03T18:03:21,0.61,Clear,Clear conditions throughout the day.,clear-day,"KDCA,72405013743,72403793728,KADW,KDAA,F8307,74594013705"
"Washington,DC,USA",3/4/21,55,35.9,45.9,55,25.5,41.3,25.8,46.6,0,0,0,,0,0,37.3,21.5,322.7,1013.8,32.2,9.9,142.8,12.3,5,,2021-03-04T06:35:42,2021-03-04T18:04:23,0.67,Partially cloudy,Partly cloudy throughout the day.,partly-cloudy-day,"KDCA,72405013743,72403793728,KADW,KDAA,F8307,74594013705"
"Washington,DC,USA",3/5/21,42.9,28,35.4,34.5,17,26.7,11.2,36.8,0,0,0,,0,0,34,20.8,309.7,1018.7,5.1,9.9,154.8,13.4,6,,2021-03-05T06:34:12,2021-03-05T18:05:25,0.72,Clear,Clear conditions throughout the day.,clear-day,"KDCA,72405013743,72403793728,KADW,KDAA,F8307,74594013705"
"Washington,DC,USA",3/6/21,46.9,30.5,38.9,41.9,26.7,32.7,16.2,39.9,0,0,0,,0,0,31.1,15,311.4,1021.4,36.9,9.9,139.4,12,5,,2021-03-06T06:32:43,2021-03-06T18:06:27,0.78,Partially cloudy,Partly cloudy throughout the day.,partly-cloudy-day,"KDCA,72405013743,72403793728,KADW,KDAA,F8307,74594013705"
"Washington,DC,USA",3/7/21,46.8,27.8,37.9,41.6,20.9,32.7,14.7,40.3,0,0,0,,0,0,27.3,17.1,332.2,1028,4.1,9.9,162.6,14,6,,2021-03-07T06:31:12,2021-03-07T18:07:29,0.83,Clear,Clear conditions throughout the day.,clear-day,"KDCA,72405013743,72403793728,KADW,KDAA,F8307,74594013705"
"Washington,DC,USA",3/8/21,53,29.2,41.6,53,29.2,39.8,16.9,41.3,0,0,0,,0,0,18.3,13.7,338.5,1031.8,42.3,9.9,163.1,14.2,6,,2021-03-08T06:29:42,2021-03-08T18:08:30,0.88,Partially cloudy,Partly cloudy throughout the day.,partly-cloudy-day,"KDCA,72405013743,72403793728,KADW,KDAA,F8307,74594013705"
"Washington,DC,USA",3/9/21,70.9,37.5,52.6,70.9,32.3,50.6,29.2,43.8,0,0,0,,0,0,21.9,12.3,206.6,1029.1,67.5,9.9,134.2,11.6,5,,2021-03-09T06:28:10,2021-03-09T18:09:31,0.93,Partially cloudy,Partly cloudy throughout the day.,partly-cloudy-day,"KDCA,72405013743,72403793728,F0198,KADW,KDAA,F8307,74594013705"
"Washington,DC,USA",3/10/21,71.8,44.3,56.3,71.8,40.2,55.4,34.8,47.9,0,0,0,,0,0,,11.2,113.2,1029.3,57.2,9.9,163.6,14.1,6,,2021-03-10T06:26:39,2021-03-10T18:10:32,0.96,Partially cloudy,Partly cloudy throughout the day.,partly-cloudy-day,"KDCA,72405013743,72403793728,KADW,KDAA,F8307,74594013705"
"Washington,DC,USA",3/11/21,78.1,52.7,63.6,78.1,52.7,63.6,36.6,38.8,0,0,0,,0,0,30.7,17.4,189.4,1023.7,69.3,9.9,164.5,14.2,6,,2021-03-11T06:25:07,2021-03-11T18:11:32,0.99,Partially cloudy,Partly cloudy throughout the day.,partly-cloudy-day,"KDCA,72405013743,72403793728,KADW,KDAA,F8307,74594013705"
"Washington,DC,USA",3/12/21,69.9,56.4,62.8,69.9,56.4,62.8,42.3,49.2,0,0,0,,0,0,31.1,13.9,273.5,1021.2,78.6,9.9,76.1,6.7,4,,2021-03-12T06:23:34,2021-03-12T18:12:32,1,Partially cloudy,Partly cloudy throughout the day.,partly-cloudy-day,"KDCA,72405013743,72403793728,KADW,KDAA,F8307,74594013705"
"Washington,DC,USA",3/13/21,58.8,46.9,52.7,58.8,40.3,51.2,16.6,24.3,0,0,0,,0,0,29.5,18.2,321.6,1025.1,70.6,9.9,161,13.9,6,,2021-03-13T06:22:01,2021-03-13T18:13:33,0,Partially cloudy,Partly cloudy throughout the day.,partly-cloudy-day,"KDCA,72405013743,72403793728,KADW,KDAA,F8307,74594013705"
"Washington,DC,USA",3/14/21,64.9,46.1,54.4,64.9,41.4,52.8,18.1,24.4,0,0,0,,0,0,53.9,36.4,312.8,1019.8,40.8,9.9,173.2,14.2,6,,2021-03-14T07:20:28,2021-03-14T19:14:32,0.01,Partially cloudy,Partly cloudy throughout the day.,wind,"KDCA,72405013743,72403793728,KADW,KDAA,F8307,74594013705"
"Washington,DC,USA",3/15/21,47.7,33.7,41.1,46,24.4,35.2,7.4,25.2,0,0,0,,0,0,34.3,22.5,356.1,1028,65.4,9.9,159.6,13.8,6,,2021-03-15T07:18:55,2021-03-15T19:15:32,0.02,Partially cloudy,Partly cloudy throughout the day.,partly-cloudy-day,"KDCA,72405013743,72403793728,KADW,KDAA,F8307,74594013705"
"Washington,DC,USA",3/16/21,44.8,40.8,42.3,40.4,34.2,37.1,29.8,62.5,0,0,0,,0,0,,12.3,155.2,1023.1,99.7,9.8,38.8,3.4,2,,2021-03-16T07:17:22,2021-03-16T19:16:32,0.04,Overcast,Cloudy skies throughout the day.,cloudy,"KDCA,72405013743,72403793728,KADW,KDAA,F8307,74594013705"
"Washington,DC,USA",3/17/21,50,41.9,46.2,49.3,37.8,44.1,40.6,81,0,0,0,,0,0,,6.6,82.5,1020.5,99.6,8.1,47.4,3.8,2,,2021-03-17T07:15:48,2021-03-17T19:17:31,0.07,Overcast,Cloudy skies throughout the day.,cloudy,"KDCA,72405013743,72403793728,KADW,KDAA,F8307,74594013705"
"Washington,DC,USA",3/18/21,53.1,47,49.7,53.1,41,47.9,47.9,93.5,0.38,100,50,rain,0,0,31.6,19.2,115.4,1011.5,100,6.7,22.3,1.8,1,,2021-03-18T07:14:14,2021-03-18T19:18:30,0.11,"Rain, Overcast",Cloudy skies throughout the day with rain.,rain,"KDCA,72405013743,72403793728,KADW,KDAA,F8307,74594013705"
"Washington,DC,USA",3/19/21,50.9,39.8,45.5,50.9,29.7,38.8,24.3,47.6,0,0,0,,0,0,35.1,24.3,10.9,1020.4,54.9,9.9,182.3,15.7,6,,2021-03-19T07:12:40,2021-03-19T19:19:29,0.15,Partially cloudy,Clearing in the afternoon.,partly-cloudy-day,"KDCA,72405013743,72403793728,KADW,KDAA,F8307,74594013705"
"Washington,DC,USA",3/20/21,58.6,31.4,44.9,58.6,24.3,41.6,17.4,34.6,0,0,0,,0,0,,14.9,30.7,1034.5,14.2,9.9,183.8,16,6,,2021-03-20T07:11:06,2021-03-20T19:20:28,0.2,Clear,Clear conditions throughout the day.,clear-day,"KDCA,72405013743,72403793728,KADW,KDAA,F8307,74594013705"
"Washington,DC,USA",3/21/21,62.8,35.2,49.5,62.8,31.6,48.7,27,46.7,0,0,0,,0,0,,9.8,78.6,1033.3,24.5,9.9,186.2,16.2,7,,2021-03-21T07:09:31,2021-03-21T19:21:26,0.24,Partially cloudy,Partly cloudy throughout the day.,partly-cloudy-day,"KDCA,72405013743,72403793728,KADW,KDAA,F8307,74594013705"
"Washington,DC,USA",3/22/21,65.7,38.1,51.9,65.7,33.9,50.7,33,50.3,0,0,0,,0,0,,9,67,1027.9,5.1,9.9,193.1,16.6,7,,2021-03-22T07:07:57,2021-03-22T19:22:25,0.29,Clear,Clear conditions throughout the day.,clear-day,"KDCA,72405013743,72403793728,KADW,KDAA,F8307,74594013705"
"Washington,DC,USA",3/23/21,67.9,45.6,56.3,67.9,42.1,55.3,42.9,61.7,0,0,0,,0,0,18.3,12.2,64,1023.6,72.3,9.9,138.5,12.1,5,,2021-03-23T07:06:23,2021-03-23T19:23:23,0.34,Partially cloudy,Partly cloudy throughout the day.,partly-cloudy-day,"KDCA,72405013743,72403793728,KADW,KDAA,F8307,74594013705"
"Washington,DC,USA",3/24/21,60,53.8,56.6,60,53.8,56.6,54.4,92.3,1.61,100,58.33,rain,0,0,,8.9,45.1,1017.5,99.8,6.3,50.7,4.3,2,,2021-03-24T07:04:48,2021-03-24T19:24:22,0.39,"Rain, Overcast",Cloudy skies throughout the day with a chance of rain throughout the day.,rain,"KDCA,72405013743,72403793728,KADW,KDAA,F8307,74594013705"
"Washington,DC,USA",3/25/21,65.3,55,59.4,65.3,55,59.4,56.6,90.9,0,0,0,,0,0,,7.9,165.7,1017.3,94.6,6.6,67.3,5.8,3,,2021-03-25T07:03:14,2021-03-25T19:25:20,0.43,Overcast,Cloudy skies throughout the day.,cloudy,"KDCA,72405013743,72403793728,KADW,KDAA,F8307,74594013705"
"Washington,DC,USA",3/26/21,83,61,71,80.6,61,70.7,52.3,57.9,0,0,0,,0,0,45.7,24.8,256.1,1011,52.2,9.9,192.4,16.5,7,,2021-03-26T07:01:40,2021-03-26T19:26:18,0.46,Partially cloudy,Clearing in the afternoon.,partly-cloudy-day,"KDCA,72405013743,72403793728,KADW,KDAA,F8307,74594013705"
"Washington,DC,USA",3/27/21,70,51.4,61.4,70,51.4,61.4,45.2,56.2,0,0,0,,0,0,21.9,14.4,183,1020.2,49.8,9.9,146.7,12.8,6,,2021-03-27T07:00:05,2021-03-27T19:27:16,0.49,Partially cloudy,Becoming cloudy in the afternoon.,partly-cloudy-day,"KDCA,72405013743,72403793728,KADW,KDAA,F8307,74594013705"
"Washington,DC,USA",3/28/21,73,53.1,60.5,73,53.1,60.5,51.8,75.1,0.51,100,25,rain,0,0,41.4,22.9,222.5,1008.3,93.2,8.9,44.6,3.7,3,,2021-03-28T06:58:31,2021-03-28T19:28:14,0.5,"Rain, Overcast",Cloudy skies throughout the day with rain.,rain,"KDCA,72405013743,72403793728,KADW,KDAA,F8307,74594013705"
"Washington,DC,USA",3/29/21,60,44,51.2,60,36.3,48,26.4,38.9,0,0,0,,0,0,45.5,26.9,288.4,1020.3,21.4,9.7,197.6,17.1,7,,2021-03-29T06:56:57,2021-03-29T19:29:12,0.51,Partially cloudy,Partly cloudy throughout the day.,partly-cloudy-day,"KDCA,72405013743,72403793728,KADW,KDAA,F8307,74594013705"
"Washington,DC,USA",3/30/21,69,45.3,56.2,69,42.4,55.5,38.1,52.4,0,0,0,,0,0,25,15.8,165,1026,25.5,9.9,204.5,17.7,7,,2021-03-30T06:55:24,2021-03-30T19:30:10,0.53,Partially cloudy,Partly cloudy throughout the day.,partly-cloudy-day,"KDCA,72405013743,72403793728,KADW,KDAA,F8307,74594013705"
"Washington,DC,USA",3/31/21,65,55.7,60.6,65,55.7,60.6,55.8,84.5,0.83,100,25,rain,0,0,26.2,19.4,177.1,1016.9,91.5,8.4,37.6,3.3,2,,2021-03-31T06:53:50,2021-03-31T19:31:08,0.55,"Rain, Overcast",Cloudy skies throughout the day with rain.,rain,"KDCA,72405013743,72403793728,KADW,KDAA,F8307,74594013705"
"Washington,DC,USA",4/1/21,60.8,35.8,45.2,60.8,24.3,38.2,33.1,64.7,0.29,100,29.17,rain,0,0,41,29.2,322.3,1016.2,83.2,9.5,57.9,5,2,,2021-04-01T06:52:17,2021-04-01T19:32:06,0.6,"Rain, Partially cloudy",Partly cloudy throughout the day with rain clearing later.,rain,"KDCA,72405013743,72403793728,KADW,KDAA,F8307,74594013705"
"Washington,DC,USA",4/2/21,46,30.7,38.3,37.8,17.6,29,14.1,38.3,0,0,0,,0,0,36.4,23.5,320.6,1025.6,40.9,9.9,193,16.6,7,,2021-04-02T06:50:44,2021-04-02T19:33:03,0.65,Partially cloudy,Partly cloudy throughout the day.,partly-cloudy-day,"KDCA,72405013743,72403793728,KADW,KDAA,F8307,74594013705"
"Washington,DC,USA",4/3/21,56.6,33.6,44.4,56.6,26.4,40.6,16,32.8,0,0,0,,0,0,16.1,12,299.5,1028.8,32.4,9.9,194.1,16.7,7,,2021-04-03T06:49:11,2021-04-03T19:34:01,0.7,Partially cloudy,Partly cloudy throughout the day.,partly-cloudy-day,"KDCA,72405013743,72403793728,KADW,KDAA,F8307,74594013705"
"Washington,DC,USA",4/4/21,71.9,43.4,58.1,71.9,40.8,56.9,28.8,35,0,0,0,,0,0,29.5,16.8,288.6,1019.7,49.9,9.9,198.8,17.3,7,,2021-04-04T06:47:39,2021-04-04T19:34:59,0.76,Partially cloudy,Clearing in the afternoon.,partly-cloudy-day,"KDCA,72405013743,72403793728,KADW,KDAA,F8307,74594013705"
"Washington,DC,USA",4/5/21,71.9,47.2,60.5,71.9,46.2,60.3,33.2,38.2,0,0,0,,0,0,23,13.1,324,1018,42.7,9.9,195.9,16.7,7,,2021-04-05T06:46:07,2021-04-05T19:35:57,0.81,Partially cloudy,Partly cloudy throughout the day.,partly-cloudy-day,"KDCA,72405013743,72403793728,KADW,KDAA,F8307,74594013705"
"Washington,DC,USA",4/6/21,76.7,55,63.9,76.7,55,63.9,39.6,42.9,0,0,0,,0,0,,11.9,68,1015.4,46.9,9.9,191,16.6,7,,2021-04-06T06:44:35,2021-04-06T19:36:54,0.86,Partially cloudy,Partly cloudy throughout the day.,partly-cloudy-day,"KDCA,72405013743,72403793728,KADW,KDAA,F8307,74594013705"
"Washington,DC,USA",4/7/21,82,54.4,65.7,80.7,54.4,65.7,46.4,51.3,0,0,0,,0,0,,11,96.2,1014.5,47.2,9.9,176.5,15.2,7,,2021-04-07T06:43:04,2021-04-07T19:37:52,0.91,Partially cloudy,Partly cloudy throughout the day.,partly-cloudy-day,"KDCA,72405013743,72403793728,KADW,KDAA,F8307,74594013705"
"Washington,DC,USA",4/8/21,71.8,53.6,62.4,71.8,53.6,62.4,43,50.2,0,0,0,,0,0,23,16.9,132,1017.4,68.5,9.9,187.5,16.1,7,,2021-04-08T06:41:33,2021-04-08T19:38:50,0.94,Partially cloudy,Partly cloudy throughout the day.,partly-cloudy-day,"KDCA,72405013743,72403793728,KADW,KDAA,F8307,74594013705"
"Washington,DC,USA",4/9/21,61,52.9,57.1,61,52.9,57.1,52.1,83.7,0.58,100,16.67,rain,0,0,,11.9,88.2,1018.6,99.7,9.3,44.6,4,2,,2021-04-09T06:40:03,2021-04-09T19:39:48,0.97,"Rain, Overcast",Cloudy skies throughout the day with rain clearing later.,rain,"KDCA,72405013743,72403793728,KADW,KDAA,F8307,74594013705"
"Washington,DC,USA",4/10/21,73.1,55,61.8,73.1,55,61.8,54.9,79.5,0,0,0,,0,0,,10.9,79.7,1013.6,93.5,8.1,126.3,10.8,6,,2021-04-10T06:38:33,2021-04-10T19:40:46,0.99,Overcast,Cloudy skies throughout the day.,cloudy,"KDCA,72405013743,72403793728,KADW,KDAA,F8307,74594013705"
"Washington,DC,USA",4/11/21,78.8,60.9,68.8,78.8,60.9,68.8,56.3,67.4,0.15,100,25,rain,0,0,31.1,17.5,200.1,999.6,79.4,9.7,164.7,14.2,7,,2021-04-11T06:37:04,2021-04-11T19:41:43,1,"Rain, Partially cloudy",Partly cloudy throughout the day with rain.,rain,"KDCA,72405013743,72403793728,KADW,KDAA,F8307,74594013705"
"Washington,DC,USA",4/12/21,64,51,57.8,64,51,57.8,50.5,76.9,0.07,100,12.5,rain,0,0,,11,46.9,1006.3,93.1,9.9,91,7.9,3,,2021-04-12T06:35:35,2021-04-12T19:42:41,0,"Rain, Overcast",Cloudy skies throughout the day with rain.,rain,"KDCA,72405013743,72403793728,KADW,KDAA,F8307,74594013705"
"Washington,DC,USA",4/13/21,66.7,50.9,57.1,66.7,50.9,57.1,47.5,71.5,0,0,0,,0,0,,10.5,20.1,1017.3,84.5,9.8,131.2,11.2,5,,2021-04-13T06:34:07,2021-04-13T19:43:39,0.01,Partially cloudy,Partly cloudy throughout the day.,partly-cloudy-day,"KDCA,72405013743,72403793728,KADW,KDAA,F8307,74594013705"
"Washington,DC,USA",4/14/21,62.1,51.4,56.8,62.1,51.4,56.8,51.8,83.5,0.28,100,50,rain,0,0,,11,194.5,1017.5,75,8.9,59.2,4.9,2,,2021-04-14T06:32:40,2021-04-14T19:44:37,0.03,"Rain, Partially cloudy",Partly cloudy throughout the day with rain.,rain,"KDCA,72405013743,72403793728,KADW,KDAA,F8307,74594013705"
"Washington,DC,USA",4/15/21,64.8,49.9,58,64.8,45.8,57.8,43,61,0.01,100,4.17,rain,0,0,35.9,20.3,306.9,1008.4,76.4,9.8,166,14.2,6,,2021-04-15T06:31:13,2021-04-15T19:45:35,0.05,"Rain, Partially cloudy",Partly cloudy throughout the day with early morning rain.,rain,"KDCA,72405013743,72403793728,KADW,KDAA,F8307,74594013705"
"Washington,DC,USA",4/16/21,61.7,43.8,51.9,61.7,39.9,50.5,31.8,46.6,0,0,0,,0,0,34.4,19.8,289.3,1009.2,47.1,9.9,99.9,8.4,4,,2021-04-16T06:29:47,2021-04-16T19:46:33,0.08,Partially cloudy,Partly cloudy throughout the day.,partly-cloudy-day,"KDCA,72405013743,72403793728,KADW,KDAA,F8307,74594013705"
"Washington,DC,USA",4/17/21,60.8,42.6,53,60.8,39.2,52.2,37.2,55.6,0,0,0,,0,0,17.2,12.7,325.8,1010.5,59,9.9,149,12.8,7,,2021-04-17T06:28:22,2021-04-17T19:47:31,0.12,Partially cloudy,Becoming cloudy in the afternoon.,partly-cloudy-day,"KDCA,72405013743,72403793728,KADW,KDAA,F8307,74594013705"
"Washington,DC,USA",4/18/21,65.8,47.3,56.8,65.8,43.6,56.1,38,50.8,0,0,0,,0,0,18.3,11.2,316.6,1012.2,66.3,9.9,193.2,16.7,7,,2021-04-18T06:26:57,2021-04-18T19:48:29,0.16,Partially cloudy,Partly cloudy throughout the day.,partly-cloudy-day,"KDCA,72405013743,72403793728,KADW,KDAA,F8307,74594013705"
"Washington,DC,USA",4/19/21,61.8,52.3,55.6,61.8,52.3,55.6,46.4,71.5,0.01,100,4.17,rain,0,0,,10.8,191,1011.9,66,9.8,110.1,9.2,5,,2021-04-19T06:25:33,2021-04-19T19:49:27,0.21,"Rain, Partially cloudy",Partly cloudy throughout the day with morning rain.,rain,"KDCA,72405013743,72403793728,KADW,KDAA,F8307,74594013705"
"Washington,DC,USA",4/20/21,74.8,46.6,61.2,74.8,43.8,60.6,44.4,59.4,0,0,0,,0,0,29.1,16.2,185,1013.5,22.1,9.9,225.2,19.4,7,,2021-04-20T06:24:10,2021-04-20T19:50:25,0.26,Partially cloudy,Partly cloudy throughout the day.,partly-cloudy-day,"KDCA,72405013743,72403793728,KADW,KDAA,F8307,74594013705"
"Washington,DC,USA",4/21/21,65.2,42.9,56.3,65.2,36.9,55,36.2,47.4,0,0,0,,0,0,46.5,31.6,273.7,1008.6,48.8,9.9,138.2,11.8,6,,2021-04-21T06:22:48,2021-04-21T19:51:23,0.31,Partially cloudy,Partly cloudy throughout the day.,wind,"KDCA,72405013743,72403793728,KADW,KDAA,F8307,74594013705"
"Washington,DC,USA",4/22/21,52.3,36.5,44.9,52.3,31.8,41.1,20.3,38.2,0,0,0,,0,0,34.9,21.4,287.7,1016.6,66.9,9.9,124.8,10.7,5,,2021-04-22T06:21:26,2021-04-22T19:52:21,0.36,Partially cloudy,Partly cloudy throughout the day.,partly-cloudy-day,"KDCA,72405013743,72403793728,KADW,KDAA,F8307,74594013705"
"Washington,DC,USA",4/23/21,62.8,37.7,52.1,62.8,33.3,51.2,28.1,41.7,0,0,0,,0,0,29.6,14.7,249.9,1019.6,26.3,9.9,188.9,16.3,7,,2021-04-23T06:20:06,2021-04-23T19:53:19,0.41,Partially cloudy,Partly cloudy throughout the day.,partly-cloudy-day,"KDCA,72405013743,72403793728,KADW,KDAA,F8307,74594013705"
"Washington,DC,USA",4/24/21,64.9,42.3,54.1,64.9,39.8,53.7,37.7,56.6,0.26,100,20.83,rain,0,0,31.1,13,178.3,1016.6,64,9.4,116.1,10.1,5,,2021-04-24T06:18:46,2021-04-24T19:54:17,0.45,"Rain, Partially cloudy",Partly cloudy throughout the day with late afternoon rain.,rain,"KDCA,72405013743,72403793728,KADW,KDAA,F8307,74594013705"
"Washington,DC,USA",4/25/21,66.6,51,57,66.6,51,57,45.7,68.5,0.62,100,37.5,rain,0,0,30.8,22.8,325.3,1009,87.4,7.8,128.8,10.8,6,,2021-04-25T06:17:28,2021-04-25T19:55:15,0.48,"Rain, Partially cloudy",Partly cloudy throughout the day with rain clearing later.,rain,"KDCA,72405013743,72403793728,KADW,KDAA,F8307,74594013705"
"Washington,DC,USA",4/26/21,67.9,46,56.9,67.9,40.6,55.8,30.4,38.7,0,0,0,,0,0,26.4,16.8,320.1,1019,28.8,9.9,227.7,19.7,7,,2021-04-26T06:16:10,2021-04-26T19:56:13,0.5,Partially cloudy,Partly cloudy throughout the day.,partly-cloudy-day,"KDCA,72405013743,72403793728,KADW,KDAA,F8307,74594013705"
"Washington,DC,USA",4/27/21,83.8,50.6,65.8,82,50.6,65.6,47.1,52.9,0,0,0,,0,0,25.3,19,184,1016.1,67.1,9.9,224.4,19.5,7,,2021-04-27T06:14:54,2021-04-27T19:57:11,0.5,Partially cloudy,Partly cloudy throughout the day.,partly-cloudy-day,"KDCA,72405013743,72403793728,KADW,KDAA,F8307,74594013705"
"Washington,DC,USA",4/28/21,85.8,63.9,73.2,85.3,63.9,73.2,57.4,58.9,0,0,0,,0,0,24.2,14.1,183.7,1012.2,82.6,9.9,191.2,16.5,7,,2021-04-28T06:13:38,2021-04-28T19:58:09,0.52,Partially cloudy,Partly cloudy throughout the day.,partly-cloudy-day,"KDCA,72405013743,72403793728,KADW,KDAA,F8307,74594013705"
"Washington,DC,USA",4/29/21,85.7,66.9,75.8,86,66.9,76.1,61.6,62.5,0,0,0,,0,0,29.9,18.7,188.5,1006.3,89.9,9.9,121.3,10.4,5,,2021-04-29T06:12:24,2021-04-29T19:59:07,0.54,Partially cloudy,Partly cloudy throughout the day.,partly-cloudy-day,"KDCA,72405013743,72403793728,KADW,KDAA,F8307,74594013705"
"Washington,DC,USA",4/30/21,72.9,53.8,64.8,72.9,53.8,64.8,41.7,45.3,0.01,100,4.17,rain,0,0,53.7,30.9,300.6,1006.4,57.4,9.7,174.2,15.1,7,,2021-04-30T06:11:11,2021-04-30T20:00:05,0.58,"Rain, Partially cloudy",Partly cloudy throughout the day with early morning rain.,rain,"KDCA,72405013743,72403793728,KADW,KDAA,F8307,74594013705"
"Washington,DC,USA",5/1/21,69,47,57.3,69,41,55.9,25.1,29.8,0,0,0,,0,0,42.1,22,305.3,1015.7,20.5,9.9,230.1,19.9,7,,2021-05-01T06:09:59,2021-05-01T20:01:02,0.63,Partially cloudy,Partly cloudy throughout the day.,partly-cloudy-day,"KDCA,72405013743,72403793728,KADW,KDAA,F8307,74594013705"
"Washington,DC,USA",5/2/21,83,54.7,68.3,81.4,54.7,68,45.1,44.5,0,0,0,,0,0,28.5,19.1,190.7,1010.8,64.1,9.9,209.9,18.2,7,,2021-05-02T06:08:48,2021-05-02T20:02:00,0.68,Partially cloudy,Partly cloudy throughout the day.,partly-cloudy-day,"KDCA,72405013743,72403793728,KADW,KDAA,F8307,74594013705"
"Washington,DC,USA",5/3/21,74.8,65.8,69.9,74.8,65.8,69.9,59.7,70.3,0.02,100,8.33,rain,0,0,26.4,15.8,188.9,1008.8,92.9,9.8,93,7.9,4,,2021-05-03T06:07:38,2021-05-03T20:02:57,0.74,"Rain, Overcast",Cloudy skies throughout the day with rain in the morning and afternoon.,rain,"KDCA,72405013743,72403793728,KADW,KDAA,F8307,74594013705"
"Washington,DC,USA",5/4/21,83.2,65.7,71.9,84.6,65.7,72.1,64.4,78.7,0.52,100,20.83,rain,0,0,45.3,13.2,190.6,1006.8,66.9,9.8,162.7,13.9,8,,2021-05-04T06:06:29,2021-05-04T20:03:55,0.79,"Rain, Partially cloudy",Partly cloudy throughout the day with rain.,rain,"KDCA,72405013743,72403793728,KADW,KDAA,F8307,74594013705"
"Washington,DC,USA",5/5/21,78.9,57.8,67.4,78.9,57.8,67.4,58.6,75.7,0.05,100,16.67,rain,0,0,38.5,23.5,304,1007.3,71.9,9.3,137.5,11.9,5,,2021-05-05T06:05:22,2021-05-05T20:04:52,0.84,"Rain, Partially cloudy",Partly cloudy throughout the day with rain in the morning and afternoon.,rain,"KDCA,72405013743,72403793728,KADW,KDAA,F8307,74594013705"
"Washington,DC,USA",5/6/21,64.9,48.7,57.9,64.9,46.1,57.5,36.8,45.9,0,0,0,,0,0,29.7,17.8,321.6,1016.3,45.5,9.9,198.8,17.2,7,,2021-05-06T06:04:16,2021-05-06T20:05:49,0.89,Partially cloudy,Becoming cloudy in the afternoon.,partly-cloudy-day,"KDCA,72405013743,72403793728,KADW,KDAA,F8307,74594013705"
"Washington,DC,USA",5/7/21,63.6,49,55.2,63.6,49,55.2,44.4,68.2,0.1,100,20.83,rain,0,0,31.1,12.2,276.7,1012.5,86.8,9.8,97.5,8.5,4,,2021-05-07T06:03:11,2021-05-07T20:06:45,0.92,"Rain, Partially cloudy",Partly cloudy throughout the day with rain.,rain,"KDCA,72405013743,72403793728,KADW,KDAA,F8307,74594013705"
"Washington,DC,USA",5/8/21,60,44.4,52.7,60,43.3,52,38.8,61.7,0.04,100,8.33,rain,0,0,35.8,21.1,312.6,1014.3,65.9,9.8,174.9,15.3,7,,2021-05-08T06:02:08,2021-05-08T20:07:42,0.96,"Rain, Partially cloudy",Partly cloudy throughout the day with rain.,rain,"KDCA,72405013743,72403793728,KADW,KDAA,F8307,74594013705"
"Washington,DC,USA",5/9/21,67.8,47.1,57.3,67.8,44.2,56.6,42.3,58,0,0,0,,0,0,26.2,16.4,172.8,1015.7,84.1,9.9,126.3,10.8,6,,2021-05-09T06:01:06,2021-05-09T20:08:38,0.98,Partially cloudy,Partly cloudy throughout the day.,partly-cloudy-day,"KDCA,72405013743,72403793728,KADW,KDAA,F8307,74594013705"
"Washington,DC,USA",5/10/21,70.1,53,61.6,70.1,53,61.6,43.3,52.1,0,0,0,,0,0,30.3,19.5,318.8,1013,59.9,9.9,191.2,16.6,7,,2021-05-10T06:00:06,2021-05-10T20:09:34,1,Partially cloudy,Partly cloudy throughout the day.,partly-cloudy-day,"KDCA,72405013743,72403793728,KADW,KDAA,F8307,74594013705"
"Washington,DC,USA",5/11/21,68.9,52.6,60.6,68.9,52.6,60.6,36.8,41.8,0,0,0,,0,0,23,14.7,322.5,1019.3,71.8,9.8,151,13.1,8,,2021-05-11T05:59:07,2021-05-11T20:10:30,1,Partially cloudy,Partly cloudy throughout the day.,partly-cloudy-day,"KDCA,72405013743,72403793728,KADW,KDAA,F8307,74594013705"
"Washington,DC,USA",5/12/21,66.6,49.8,57.7,66.6,45.9,57.4,33,39.7,0,0,0,,0,0,21.9,14.8,336.3,1024,79.1,9.9,194.1,16.7,7,,2021-05-12T05:58:09,2021-05-12T20:11:25,0,Partially cloudy,Partly cloudy throughout the day.,partly-cloudy-day,"KDCA,72405013743,72403793728,KADW,KDAA,F8307,74594013705"
"Washington,DC,USA",5/13/21,71.5,48.3,61.2,71.5,45.9,61.1,35.2,41.6,0,0,0,,0,0,19.7,12,340.5,1024.2,40.4,9.9,199.2,17.2,8,,2021-05-13T05:57:13,2021-05-13T20:12:20,0.01,Partially cloudy,Becoming cloudy in the afternoon.,partly-cloudy-day,"KDCA,72405013743,72403793728,KADW,KDAA,F8307,74594013705"
"Washington,DC,USA",5/14/21,72.8,52.2,62.2,72.8,52.2,62.2,38.5,44,0,0,0,,0,0,,8.9,229.4,1024.1,58.1,9.9,161.3,13.9,8,,2021-05-14T05:56:18,2021-05-14T20:13:14,0.03,Partially cloudy,Partly cloudy throughout the day.,partly-cloudy-day,"KDCA,72405013743,72403793728,KADW,KDAA,F8307,74594013705"
"Washington,DC,USA",5/15/21,77.9,51.2,64.8,77.9,51.2,64.8,40.1,44.7,0,0,0,,0,0,,9.7,117.2,1023.6,52.3,9.9,162,13.9,7,,2021-05-15T05:55:25,2021-05-15T20:14:09,0.06,Partially cloudy,Becoming cloudy in the afternoon.,partly-cloudy-day,"KDCA,72405013743,72403793728,KADW,KDAA,F8307,74594013705"
"Washington,DC,USA",5/16/21,72,53,61.4,72,53,61.4,46.8,59.5,0,0,0,,0,0,25.3,10.9,190,1024.8,86.6,9.9,131.6,11.3,7,,2021-05-16T05:54:34,2021-05-16T20:15:02,0.09,Partially cloudy,Partly cloudy throughout the day.,partly-cloudy-day,"KDCA,72405013743,72403793728,KADW,KDAA,F8307,74594013705"
"Washington,DC,USA",5/17/21,73.8,53.4,64.5,73.8,53.4,64.5,49,59.3,0,0,0,,0,0,,7.5,104.6,1025.9,70.6,9.9,144.1,12.4,6,,2021-05-17T05:53:44,2021-05-17T20:15:55,0.14,Partially cloudy,Partly cloudy throughout the day.,partly-cloudy-day,"KDCA,72405013743,72403793728,KADW,KDAA,F8307,74594013705"
"Washington,DC,USA",5/18/21,78.2,55.2,67.3,78.2,55.2,67.3,49.1,54.7,0,0,0,,0,0,,10.9,178.9,1027.4,44.3,9.9,235.2,20.3,8,,2021-05-18T05:52:55,2021-05-18T20:16:48,0.18,Partially cloudy,Partly cloudy throughout the day.,partly-cloudy-day,"KDCA,72405013743,72403793728,KADW,KDAA,F8307,74594013705"
"Washington,DC,USA",5/19/21,83.9,58.4,71.5,81.9,58.4,71.2,51.6,51.6,0,0,0,,0,0,,12,185.1,1027.4,24.5,9.6,232.3,20.2,8,,2021-05-19T05:52:09,2021-05-19T20:17:40,0.23,Partially cloudy,Partly cloudy throughout the day.,partly-cloudy-day,"KDCA,72405013743,72403793728,KADW,KDAA,F8307,74594013705"
"Washington,DC,USA",5/20/21,89.5,62.2,74.3,87.1,62.2,73.8,53.9,52.8,0,0,0,,0,0,23,15.4,136.6,1029.1,43.3,9.9,224.7,19.3,7,,2021-05-20T05:51:24,2021-05-20T20:18:32,0.28,Partially cloudy,Partly cloudy throughout the day.,partly-cloudy-day,"KDCA,72405013743,72403793728,KADW,KDAA,F8307,74594013705"
"Washington,DC,USA",5/21/21,82.8,59,70.8,81.4,59,70.6,48.9,47.8,0,0,0,,0,0,,11,176.9,1032.4,51.1,9.9,235.5,20.5,8,,2021-05-21T05:50:40,2021-05-21T20:19:22,0.34,Partially cloudy,Partly cloudy throughout the day.,partly-cloudy-day,"KDCA,72405013743,72403793728,KADW,KDAA,F8307,74594013705"
"Washington,DC,USA",5/22/21,89.8,62.2,76.8,87.8,62.2,76.2,54.5,48.1,0,0,0,,0,0,22.5,14.5,290.7,1025.1,83,9.9,182.8,15.7,7,,2021-05-22T05:49:58,2021-05-22T20:20:13,0.39,Partially cloudy,Partly cloudy throughout the day.,partly-cloudy-day,"KDCA,72405013743,72403793728,KADW,KDAA,F8307,74594013705"
"Washington,DC,USA",5/23/21,92.7,74.3,84,92.5,74.3,83.9,57.6,41.1,0,0,0,,0,0,30.2,19,311.1,1017.2,58.8,9.9,224.4,19.5,7,,2021-05-23T05:49:19,2021-05-23T20:21:02,0.44,Partially cloudy,Clearing in the afternoon.,partly-cloudy-day,"KDCA,72405013743,72403793728,KADW,KDAA,F8307,74594013705"
"Washington,DC,USA",5/24/21,83.5,60.7,68.4,83.9,60.7,68.4,57.5,69.3,0.34,100,33.33,rain,0,0,21.9,15.5,79.5,1022.7,96.7,8.9,51.6,4.4,2,,2021-05-24T05:48:40,2021-05-24T20:21:51,0.47,"Rain, Overcast",Cloudy skies throughout the day with rain.,rain,"KDCA,72405013743,72403793728,KADW,KDAA,F8307,74594013705"
"Washington,DC,USA",5/25/21,78,58.7,66.9,78,58.7,66.9,57.7,72.9,0,0,0,,0,0,,11,156.7,1024.1,86.9,9.9,195.9,17,7,,2021-05-25T05:48:04,2021-05-25T20:22:39,0.49,Partially cloudy,Partly cloudy throughout the day.,partly-cloudy-day,"KDCA,72405013743,72403793728,KADW,KDAA,F8307,74594013705"
"Washington,DC,USA",5/26/21,90.1,68.8,76.2,93.8,68.8,77.2,67.1,75.1,0.87,100,16.67,rain,0,0,39.1,16.3,188.3,1017,71.5,9.7,210.1,18.2,7,,2021-05-26T05:47:29,2021-05-26T20:23:26,0.5,"Rain, Partially cloudy",Partly cloudy throughout the day with late afternoon rain.,rain,"KDCA,72405013743,72403793728,KADW,KDAA,F8307,74594013705"
"Washington,DC,USA",5/27/21,84.7,69.7,77.1,82.9,69.7,76.8,59.3,56.6,0,0,0,,0,0,20.8,16.5,312.5,1015.7,59.1,9.9,219.2,18.9,8,,2021-05-27T05:46:56,2021-05-27T20:24:12,0.51,Partially cloudy,Partly cloudy throughout the day.,partly-cloudy-day,"KDCA,72405013743,72403793728,KADW,KDAA,F8307,74594013705"
"Washington,DC,USA",5/28/21,74.8,62,70.2,74.8,62,70.2,58.2,66.6,0.69,100,20.83,rain,0,0,19.7,14.1,51.7,1011.9,89,9.6,103.4,8.7,6,,2021-05-28T05:46:25,2021-05-28T20:24:58,0.53,"Rain, Partially cloudy",Partly cloudy throughout the day with late afternoon rain.,rain,"KDCA,72405013743,72403793728,KADW,KDAA,F8307,74594013705"
"Washington,DC,USA",5/29/21,60.9,51.9,54.4,60.9,51.9,54.4,50.5,86.8,0.96,100,66.67,rain,0,0,27.7,16.8,30,1013.3,99.8,6.9,46.6,4,2,,2021-05-29T05:45:56,2021-05-29T20:25:42,0.56,"Rain, Overcast",Cloudy skies throughout the day with a chance of rain throughout the day.,rain,"KDCA,72405013743,72403793728,KADW,KDAA,F8307,74594013705"
"Washington,DC,USA",5/30/21,56.6,49.7,53.2,56.6,44.1,52.6,46.4,77.8,0.17,100,20.83,rain,0,0,21.9,16,2.2,1021.2,97.6,9.5,71.1,6,2,,2021-05-30T05:45:28,2021-05-30T20:26:25,0.61,"Rain, Overcast",Cloudy skies throughout the day with rain clearing later.,rain,"KDCA,72405013743,72403793728,KADW,KDAA,F8307,74594013705"
"Washington,DC,USA",5/31/21,74.7,49.7,62.5,74.7,47.6,62.4,47.1,60.2,0,0,0,,0,0,20.8,13.8,308.7,1025.1,43.5,9.9,242.7,21.1,7,,2021-05-31T05:45:03,2021-05-31T20:27:08,0.66,Partially cloudy,Becoming cloudy in the afternoon.,partly-cloudy-day,"KDCA,72405013743,72403793728,KADW,KDAA,F8307,74594013705"
"Washington,DC,USA",6/1/21,77,57.2,67.7,77,57.2,67.7,56.4,68.2,0,0,0,,0,0,17.2,14.6,177.9,1024.6,75.6,9.9,218.8,18.8,8,,2021-06-01T05:44:39,2021-06-01T20:27:49,0.71,Partially cloudy,Partly cloudy throughout the day.,partly-cloudy-day,"KDCA,72405013743,72403793728,KADW,KDAA,F8307,74594013705"
"Washington,DC,USA",6/2/21,80.7,64.4,71.4,81.4,64.4,71.5,58.3,64.2,0,0,0,,0,0,21.9,13.9,166.9,1022,89.6,9.9,213.9,18.6,7,,2021-06-02T05:44:17,2021-06-02T20:28:29,0.76,Partially cloudy,Partly cloudy throughout the day.,partly-cloudy-day,"KDCA,72405013743,72403793728,KADW,KDAA,F8307,74594013705"
"Washington,DC,USA",6/3/21,82.1,66.7,72.7,85,66.7,73.3,65.9,79.9,0.1,100,16.67,rain,0,0,21.9,18,181.5,1016.4,93.8,8.9,157.5,13.6,6,,2021-06-03T05:43:57,2021-06-03T20:29:09,0.81,"Rain, Overcast",Cloudy skies throughout the day with rain.,rain,"KDCA,72405013743,72403793728,KADW,KDAA,F8307,74594013705"
"Washington,DC,USA",6/4/21,84.7,70,74.7,84.8,70,74.8,65.6,75.9,0.09,100,8.33,rain,0,0,24.2,16.1,206.3,1013.9,77.1,9.9,205.3,17.8,7,,2021-06-04T05:43:39,2021-06-04T20:29:47,0.86,"Rain, Partially cloudy",Partly cloudy throughout the day with afternoon rain.,rain,"KDCA,72405013743,72403793728,KADW,KDAA,F8307,74594013705"
"Washington,DC,USA",6/5/21,91,68.6,79.7,91.6,68.6,80.1,64.4,63.1,0,0,0,,0,0,23,14.8,197.7,1016.3,29.9,9.9,240.3,20.7,8,,2021-06-05T05:43:22,2021-06-05T20:30:23,0.9,Partially cloudy,Partly cloudy throughout the day.,partly-cloudy-day,"KDCA,72405013743,72403793728,KADW,KDAA,F8307,74594013705"
"Washington,DC,USA",6/6/21,91.9,71.3,81.2,95.3,71.3,83.3,67.4,64.7,0,0,0,,0,0,,12.4,177.5,1017.7,45.3,9.9,248.8,21.5,8,,2021-06-06T05:43:08,2021-06-06T20:30:59,0.94,Partially cloudy,Partly cloudy throughout the day.,partly-cloudy-day,"KDCA,72405013743,72403793728,KADW,KDAA,F8307,74594013705"
"Washington,DC,USA",6/7/21,89.9,75.3,82.3,97.9,75.3,86.2,71.5,70.5,0,0,0,,0,0,,13.3,178.7,1018.4,70.9,9.9,220.1,18.9,8,,2021-06-07T05:42:55,2021-06-07T20:31:33,0.97,Partially cloudy,Partly cloudy throughout the day.,partly-cloudy-day,"KDCA,72405013743,72403793728,KADW,KDAA,F8307,74594013705"
"Washington,DC,USA",6/8/21,88.1,75.6,81.6,96.6,75.6,85.2,71.4,71.5,0.01,100,4.17,rain,0,0,,13.1,182.3,1017.7,81.3,9.9,179.8,15.7,6,,2021-06-08T05:42:44,2021-06-08T20:32:06,0.99,"Rain, Partially cloudy",Partly cloudy throughout the day with afternoon rain.,rain,"KDCA,72405013743,72403793728,KADW,KDAA,F8307,74594013705"
"Washington,DC,USA",6/9/21,87.9,75.5,81.5,93.8,75.5,83.9,69.5,67.4,0,0,0,,0,0,,12.1,314.9,1016.7,82.7,9.9,127.1,11,4,,2021-06-09T05:42:36,2021-06-09T20:32:37,1,Partially cloudy,Partly cloudy throughout the day.,partly-cloudy-day,"KDCA,72405013743,72403793728,KADW,KDAA,F8307,74594013705"
"Washington,DC,USA",6/10/21,87.2,71.7,77.8,91.6,71.7,78.9,69.3,76,0.94,100,29.17,rain,0,0,17.2,14.1,63.1,1014.4,88.4,9.1,135.5,11.6,6,,2021-06-10T05:42:29,2021-06-10T20:33:07,0,"Rain, Partially cloudy",Partly cloudy throughout the day with rain.,rain,"KDCA,72405013743,72403793728,KADW,KDAA,F8307,74594013705"
"Washington,DC,USA",6/11/21,70.8,66.7,68.9,70.8,66.7,68.9,66.2,91,1.74,100,66.67,rain,0,0,17.2,14.9,57.8,1011.5,100,6.7,29.6,2.3,1,,2021-06-11T05:42:23,2021-06-11T20:33:36,0.01,"Rain, Overcast",Cloudy skies throughout the day with a chance of rain throughout the day.,rain,"KDCA,72405013743,72403793728,KADW,KDAA,F8307,74594013705"
"Washington,DC,USA",6/12/21,78.7,64.9,70.8,78.7,64.9,70.8,61,72.6,0,0,0,,0,0,21.9,13.1,35.9,1010.5,89.6,9.8,151.7,13,6,,2021-06-12T05:42:20,2021-06-12T20:34:03,0.02,Partially cloudy,Partly cloudy throughout the day.,partly-cloudy-day,"KDCA,72405013743,72403793728,KADW,KDAA,F8307,74594013705"
"Washington,DC,USA",6/13/21,81.9,67.5,74.1,83.7,67.5,74.2,64.1,71.6,0,0,0,,0,0,,12.3,169.5,1012.4,83.5,9.9,169.2,14.6,7,,2021-06-13T05:42:19,2021-06-13T20:34:28,0.04,Partially cloudy,Partly cloudy throughout the day.,partly-cloudy-day,"KDCA,72405013743,72403793728,KADW,KDAA,F8307,74594013705"
"Washington,DC,USA",6/14/21,87.8,67.6,77,89.7,67.6,77.9,64.4,66.2,0.14,100,4.17,rain,0,0,38.6,19.3,189.7,1009.6,67.9,9.6,213,18.3,8,,2021-06-14T05:42:19,2021-06-14T20:34:53,0.08,"Rain, Partially cloudy",Partly cloudy throughout the day with late afternoon rain.,rain,"KDCA,72405013743,72403793728,KADW,KDAA,F8307,74594013705"
"Washington,DC,USA",6/15/21,80.8,65.9,73.6,80.6,65.9,73.6,59.2,63.5,1.57,100,12.5,rain,0,0,29.8,18.9,325.5,1009.7,58.7,9.5,222,19.4,8,,2021-06-15T05:42:21,2021-06-15T20:35:15,0.12,"Rain, Partially cloudy",Becoming cloudy in the afternoon with early morning rain.,rain,"KDCA,72405013743,72403793728,KADW,KDAA,F8307,74594013705"
"Washington,DC,USA",6/16/21,80,65.8,73,80,65.8,73,48,42.9,0,0,0,,0,0,22.9,13.7,318.7,1013,48.1,9.9,261.6,22.5,8,,2021-06-16T05:42:25,2021-06-16T20:35:36,0.16,Partially cloudy,Clearing in the afternoon.,partly-cloudy-day,"KDCA,72405013743,72403793728,KADW,KDAA,F8307,74594013705"
"Washington,DC,USA",6/17/21,79,60.1,71.3,79,60.1,71.3,42.8,37.1,0,0,0,,0,0,19.7,11.9,326.6,1016.5,40.5,9.9,258.1,22.3,8,,2021-06-17T05:42:31,2021-06-17T20:35:55,0.21,Partially cloudy,Partly cloudy throughout the day.,partly-cloudy-day,"KDCA,72405013743,72403793728,KADW,KDAA,F8307,74594013705"
"Washington,DC,USA",6/18/21,84.7,60.2,73.7,83.8,60.2,73.6,54.7,52.7,0,0,0,,0,0,21.9,14.6,192.1,1016.3,42.4,9.9,233.4,20,8,,2021-06-18T05:42:38,2021-06-18T20:36:13,0.27,Partially cloudy,Becoming cloudy in the afternoon.,partly-cloudy-day,"KDCA,72405013743,72403793728,KADW,KDAA,F8307,74594013705"
"Washington,DC,USA",6/19/21,87.2,73,78.9,89.1,73,79.7,64.4,61.6,0,0,0,,0,0,24.2,13.9,210.5,1010.6,86.6,9.9,105.4,9,5,,2021-06-19T05:42:47,2021-06-19T20:36:28,0.32,Partially cloudy,Partly cloudy throughout the day.,partly-cloudy-day,"KDCA,72405013743,72403793728,KADW,KDAA,F8307,74594013705"
"Washington,DC,USA",6/20/21,88.1,72.6,80.4,94.1,72.6,83.1,70.5,73,0.15,100,8.33,rain,0,0,,14.9,181.1,1009.8,79.5,9.3,238.9,20.5,8,,2021-06-20T05:42:58,2021-06-20T20:36:43,0.38,"Rain, Partially cloudy",Partly cloudy throughout the day with early morning rain.,rain,"KDCA,72405013743,72403793728,KADW,KDAA,F8307,74594013705"
"Washington,DC,USA",6/21/21,89.9,74.6,80.4,99.1,74.6,83,71.5,75.3,0.05,100,4.17,rain,0,0,31.5,14.6,181.9,1006.2,80.1,9.9,220.6,19.1,8,,2021-06-21T05:43:11,2021-06-21T20:36:55,0.42,"Rain, Partially cloudy",Partly cloudy throughout the day with late afternoon rain.,rain,"KDCA,72405013743,72403793728,KADW,KDAA,F8307,74594013705"
"Washington,DC,USA",6/22/21,75.5,64.3,70.2,75.5,64.3,70.2,62.7,77.9,0.33,100,25,rain,0,0,21.9,12.8,333.7,1009,82.5,9.3,56.9,4.8,2,,2021-06-22T05:43:25,2021-06-22T20:37:06,0.46,"Rain, Partially cloudy",Partly cloudy throughout the day with rain in the morning and afternoon.,rain,"KDCA,72405013743,72403793728,KADW,KDAA,F8307,74594013705"
"Washington,DC,USA",6/23/21,77.6,56.2,67.2,77.6,56.2,67.2,46.9,50.5,0,0,0,,0,0,,12.4,33.9,1022.4,34.4,9.9,253.9,22.1,8,,2021-06-23T05:43:41,2021-06-23T20:37:14,0.49,Partially cloudy,Partly cloudy throughout the day.,partly-cloudy-day,"KDCA,72405013743,72403793728,KADW,KDAA,F8307,74594013705"
"Washington,DC,USA",6/24/21,77.9,59.4,70.4,77.9,59.4,70.4,51.8,53,0,0,0,,0,0,17.2,9.7,111.6,1026.7,40.4,9.9,233.2,20.2,7,,2021-06-24T05:43:59,2021-06-24T20:37:21,0.5,Partially cloudy,Partly cloudy throughout the day.,partly-cloudy-day,"KDCA,72405013743,72403793728,KADW,KDAA,F8307,74594013705"
"Washington,DC,USA",6/25/21,80,62.2,71.8,80.7,62.2,71.8,59,65.2,0,0,0,,0,0,,12.3,164.9,1025.4,56.3,9.9,233.4,20,8,,2021-06-25T05:44:18,2021-06-25T20:37:27,0.51,Partially cloudy,Partly cloudy throughout the day.,partly-cloudy-day,"KDCA,72405013743,72403793728,KADW,KDAA,F8307,74594013705"
"Washington,DC,USA",6/26/21,84.7,72.9,78.3,88.8,72.9,80.1,70,76.3,0.13,100,8.33,rain,0,0,,15,178.5,1022.5,89.7,9.7,203.4,17.6,9,,2021-06-26T05:44:39,2021-06-26T20:37:30,0.53,"Rain, Partially cloudy",Partly cloudy throughout the day with morning rain.,rain,"KDCA,72405013743,72403793728,KADW,KDAA,F8307,74594013705"
"Washington,DC,USA",6/27/21,88.1,73.8,80.9,95.6,73.8,84.2,71,72.7,0,0,0,,0,0,27.3,17.8,184.9,1021.9,77.7,9.9,233,20.2,7,,2021-06-27T05:45:01,2021-06-27T20:37:32,0.55,Partially cloudy,Partly cloudy throughout the day.,partly-cloudy-day,"KDCA,72405013743,72403793728,KADW,KDAA,F8307,74594013705"
"Washington,DC,USA",6/28/21,90,75.5,83,99.1,75.5,86.9,71.6,69.4,0,0,0,,0,0,,13.6,178.9,1023.4,30.7,9.9,264.6,22.9,8,,2021-06-28T05:45:25,2021-06-28T20:37:31,0.59,Partially cloudy,Partly cloudy throughout the day.,partly-cloudy-day,"KDCA,72405013743,72403793728,KADW,KDAA,F8307,74594013705"
"Washington,DC,USA",6/29/21,92.8,76.5,83.9,98.9,76.5,88.1,72,68.8,0,0,0,,0,0,20.8,15.4,184.8,1023.3,38.5,9.9,259.5,22.5,8,,2021-06-29T05:45:50,2021-06-29T20:37:29,0.64,Partially cloudy,Becoming cloudy in the afternoon.,partly-cloudy-day,"KDCA,72405013743,72403793728,KADW,KDAA,F8307,74594013705"
"Washington,DC,USA",6/30/21,93.9,75.4,84.9,102.9,75.4,88.8,69.6,61.3,0.03,100,8.33,rain,0,0,33.3,14.9,200.9,1017.7,41.4,9.9,232.3,20,8,,2021-06-30T05:46:17,2021-06-30T20:37:25,0.69,"Rain, Partially cloudy",Partly cloudy throughout the day with late afternoon rain.,rain,"KDCA,72405013743,72403793728,KADW,KDAA,F8307,74594013705"
"Washington,DC,USA",7/1/21,90.1,71.6,79.2,96.3,71.6,80.7,70,74.2,1.18,100,12.5,rain,0,0,57.2,8.8,192.2,1012.1,79.1,9.9,129.9,11.1,6,,2021-07-01T05:46:45,2021-07-01T20:37:19,0.74,"Rain, Partially cloudy",Partly cloudy throughout the day with rain.,rain,"KDCA,72405013743,72403793728,KADW,KDAA,F8307,74594013705"
"Washington,DC,USA",7/2/21,80.9,70.8,74.6,81.5,70.8,74.7,62.1,68.6,0.11,100,25,rain,0,0,27.7,16.6,299.4,1008.7,81.2,9.9,147.1,12.8,6,,2021-07-02T05:47:14,2021-07-02T20:37:11,0.78,"Rain, Partially cloudy",Partly cloudy throughout the day with rain clearing later.,rain,"KDCA,72405013743,72403793728,KADW,KDAA,F8307,74594013705"
"Washington,DC,USA",7/3/21,80.6,62.9,72,80.6,62.9,72,55.6,57.5,0.01,100,4.17,rain,0,0,32.6,15.5,323.5,1009.9,70.3,9.9,182.5,15.8,7,,2021-07-03T05:47:45,2021-07-03T20:37:01,0.83,"Rain, Partially cloudy",Partly cloudy throughout the day with late afternoon rain.,rain,"KDCA,72405013743,72403793728,KADW,KDAA,F8307,74594013705"
"Washington,DC,USA",7/4/21,83.8,64.5,75.4,84.1,64.5,75.5,60.3,61.4,0,0,0,,0,0,,11,234.8,1012.8,58.5,9.8,206.8,17.9,7,,2021-07-04T05:48:17,2021-07-04T20:36:49,0.88,Partially cloudy,Partly cloudy throughout the day.,partly-cloudy-day,"KDCA,72405013743,72403793728,KADW,KDAA,F8307,74594013705"
"Washington,DC,USA",7/5/21,88,70.4,79.5,91.5,70.4,80.9,66.4,65.3,0,0,0,,0,0,,13.7,168.8,1016.8,68.1,9.1,215.7,18.4,7,,2021-07-05T05:48:50,2021-07-05T20:36:36,0.91,Partially cloudy,Partly cloudy throughout the day.,partly-cloudy-day,"KDCA,72405013743,72403793728,KADW,KDAA,F8307,74594013705"
"Washington,DC,USA",7/6/21,92.8,73.6,83.1,101.5,73.6,87.3,70.2,66.3,0,0,0,,0,0,27.4,15.5,191.1,1017,35.9,9.9,222.5,19.3,7,,2021-07-06T05:49:25,2021-07-06T20:36:20,0.95,Partially cloudy,Partly cloudy throughout the day.,partly-cloudy-day,"KDCA,72405013743,72403793728,KADW,KDAA,F8307,74594013705"
"Washington,DC,USA",7/7/21,92.8,76.5,84.8,103.7,76.5,89.8,71.2,64.6,0,0,0,,0,0,16.1,15.4,184.3,1014.9,46.6,9.1,226.1,19.5,7,,2021-07-07T05:50:01,2021-07-07T20:36:03,0.97,Partially cloudy,Partly cloudy throughout the day.,partly-cloudy-day,"KDCA,72405013743,72403793728,KADW,KDAA,F8307,74594013705"
"Washington,DC,USA",7/8/21,84.9,72.9,79.6,92.2,72.9,81.7,70,72.7,0.23,100,20.83,rain,0,0,32.2,17.8,178,1014.1,88.4,9.9,118.9,10.3,5,,2021-07-08T05:50:38,2021-07-08T20:35:44,0.99,"Rain, Partially cloudy",Partly cloudy throughout the day with rain.,rain,"KDCA,72405013743,72403793728,KADW,KDAA,F8307,74594013705"
"Washington,DC,USA",7/9/21,89.7,70.9,77.3,95.3,70.9,78.7,69.6,78.2,0.83,100,16.67,rain,0,0,29.9,16.9,264.9,1011.6,69.8,9.4,169.9,14.9,7,,2021-07-09T05:51:16,2021-07-09T20:35:22,1,"Rain, Partially cloudy",Becoming cloudy in the afternoon with rain.,rain,"KDCA,72405013743,72403793728,KDAA,KADW,F8307,74594013705"
"Washington,DC,USA",7/10/21,82.9,70.7,76.7,83.9,70.7,77,62.4,62.6,0,0,0,,0,0,20.8,14.5,323.6,1016.3,80.1,9.9,233.1,20,7,,2021-07-10T05:51:55,2021-07-10T20:34:59,0,Partially cloudy,Partly cloudy throughout the day.,partly-cloudy-day,"KDCA,72405013743,72403793728,KADW,KDAA,F8307,74594013705"
"Washington,DC,USA",7/11/21,89.8,74.4,81.9,98,74.4,86.1,70,67.6,0,0,0,,0,0,19.7,15.4,174.7,1016.7,80,9.9,194.2,16.7,7,,2021-07-11T05:52:35,2021-07-11T20:34:34,0.01,Partially cloudy,Partly cloudy throughout the day.,partly-cloudy-day,"KDCA,72405013743,72403793728,KADW,KDAA,F8307,74594013705"
"Washington,DC,USA",7/12/21,91.1,77.9,84.1,102.7,77.9,89.5,73.6,71.6,0,0,0,,0,0,,16.6,186.8,1018.6,65.8,9.9,221.4,19.3,7,,2021-07-12T05:53:16,2021-07-12T20:34:07,0.03,Partially cloudy,Partly cloudy throughout the day.,partly-cloudy-day,"KDCA,72405013743,72403793728,KADW,KDAA,F8307,74594013705"
"Washington,DC,USA",7/13/21,92.8,77.9,85.1,102.8,77.9,90.4,72.1,66.1,0,0,0,,0,0,25.7,18.8,185.5,1021.1,61.4,9.9,218.6,18.9,8,,2021-07-13T05:53:58,2021-07-13T20:33:38,0.06,Partially cloudy,Becoming cloudy in the afternoon.,partly-cloudy-day,"KDCA,72405013743,72403793728,KADW,KDAA,F8307,74594013705"
"Washington,DC,USA",7/14/21,89.9,73.8,81.6,93.8,73.8,83.6,69.3,67.9,0,0,0,,0,0,,11.3,204,1021.3,65.2,9.7,135.1,11.6,7,,2021-07-14T05:54:41,2021-07-14T20:33:08,0.1,Partially cloudy,Becoming cloudy in the afternoon.,partly-cloudy-day,"KDCA,72405013743,72403793728,KADW,KDAA,F8307,74594013705"
"Washington,DC,USA",7/15/21,90,71.6,81.6,97.1,71.6,84.5,69.7,69.1,0,0,0,,0,0,,13.3,188.1,1019.2,68.1,9.9,200.3,17.2,7,,2021-07-15T05:55:24,2021-07-15T20:32:35,0.14,Partially cloudy,Partly cloudy throughout the day.,partly-cloudy-day,"KDCA,72405013743,72403793728,KADW,KDAA,F8307,74594013705"
"Washington,DC,USA",7/16/21,92.9,77.6,85.4,97.1,77.6,88.9,69,59.1,0,0,0,,0,0,,15.3,182.8,1017,52.1,9.9,231.7,20.1,8,,2021-07-16T05:56:09,2021-07-16T20:32:01,0.2,Partially cloudy,Partly cloudy throughout the day.,partly-cloudy-day,"KDCA,72405013743,72403793728,KADW,KDAA,F8307,74594013705"
"Washington,DC,USA",7/17/21,92.9,78.5,84.6,104,78.5,90,72.1,66.9,0,0,0,,0,0,28.4,20,191.6,1016.2,66.4,9.9,191.3,16.7,8,,2021-07-17T05:56:54,2021-07-17T20:31:25,0.25,Partially cloudy,Partly cloudy throughout the day.,partly-cloudy-day,"KDCA,72405013743,72403793728,KADW,KDAA,F8307,74594013705"
"Washington,DC,USA",7/18/21,83,73.9,78.1,83.4,73.9,78.2,62.7,60,0,0,0,,0,0,28.7,17.1,291.8,1017.3,72.8,9.9,191.1,16.5,7,,2021-07-18T05:57:40,2021-07-18T20:30:47,0.31,Partially cloudy,Partly cloudy throughout the day.,partly-cloudy-day,"KDCA,72405013743,72403793728,KADW,KDAA,F8307,74594013705"
"Washington,DC,USA",7/19/21,88.9,72,79.9,89.2,72,80.6,63.3,57.9,0,0,0,,0,0,,10.3,229.5,1017.2,73.8,9.9,187,16.1,6,,2021-07-19T05:58:27,2021-07-19T20:30:08,0.37,Partially cloudy,Partly cloudy throughout the day.,partly-cloudy-day,"KDCA,72405013743,72403793728,KADW,KDAA,F8307,74594013705"
"Washington,DC,USA",7/20/21,92.8,72.3,82.4,93.8,72.3,83.4,65,57.6,0,0,0,,0,0,,10.8,287.1,1014.1,13.6,9.4,191.4,16.3,6,,2021-07-20T05:59:14,2021-07-20T20:29:26,0.41,Clear,Clear conditions throughout the day.,clear-day,"KDCA,72405013743,72403793728,KADW,KDAA,F8307,74594013705"
"Washington,DC,USA",7/21/21,88.7,75.3,81.2,93.8,75.3,82.4,65.7,60,0.41,100,4.17,rain,0,0,50.6,19.1,327.7,1012.8,41.6,8.8,163.7,14,5,,2021-07-21T06:00:03,2021-07-21T20:28:43,0.45,"Rain, Partially cloudy",Partly cloudy throughout the day with afternoon rain.,rain,"KDCA,72405013743,72403793728,KADW,KDAA,F8307,74594013705"
"Washington,DC,USA",7/22/21,83.7,68.7,76.2,82,68.7,75.9,54.3,48.3,0,0,0,,0,0,19.7,13.8,350.5,1019.8,62,9.9,216,18.5,7,,2021-07-22T06:00:51,2021-07-22T20:27:58,0.48,Partially cloudy,Partly cloudy throughout the day.,partly-cloudy-day,"KDCA,72405013743,72403793728,KADW,KDAA,F8307,74594013705"
"Washington,DC,USA",7/23/21,85.7,67.3,76.4,83.7,67.3,75.9,54.6,48.6,0,0,0,,0,0,,9.8,26.7,1020.9,65,9.9,212.8,18.5,7,,2021-07-23T06:01:40,2021-07-23T20:27:12,0.5,Partially cloudy,Partly cloudy throughout the day.,partly-cloudy-day,"KDCA,72405013743,72403793728,KADW,KDAA,F8307,74594013705"
"Washington,DC,USA",7/24/21,85.7,69.2,77.4,87,69.2,77.7,61.5,58.7,0.02,100,8.33,rain,0,0,23,15.5,171.2,1018.7,80.7,9.8,138.8,12.1,7,,2021-07-24T06:02:30,2021-07-24T20:26:23,0.5,"Rain, Partially cloudy",Partly cloudy throughout the day with late afternoon rain.,rain,"KDCA,72405013743,72403793728,F0198,KADW,KDAA,F8307,74594013705"
"Washington,DC,USA",7/25/21,88.3,73.9,80.5,94.8,73.9,83.8,68.8,67.8,0,0,0,,0,0,23,14.3,187.6,1013.6,86.4,9.9,61,5.2,3,,2021-07-25T06:03:20,2021-07-25T20:25:33,0.52,Partially cloudy,Partly cloudy throughout the day.,partly-cloudy-day,"KDCA,72405013743,72403793728,F0198,KADW,KDAA,74594013705"
"Washington,DC,USA",7/26/21,96,74.6,82.6,98.5,74.6,84.5,69.3,67,0.27,100,4.17,rain,0,0,32.3,13.8,190.7,1013.2,75.3,9.6,58.2,4.9,3,,2021-07-26T06:04:11,2021-07-26T20:24:42,0.54,"Rain, Partially cloudy",Partly cloudy throughout the day with late afternoon rain.,rain,"KDCA,72405013743,72403793728,F0198,KADW,KDAA,74594013705"
"Washington,DC,USA",7/27/21,94.8,72.6,82.7,95.6,72.6,83.6,66.3,62,0.07,100,4.17,rain,0,0,,10.8,317.4,1014.7,40.6,9.8,76.7,6.7,5,,2021-07-27T06:05:02,2021-07-27T20:23:49,0.57,"Rain, Partially cloudy",Partly cloudy throughout the day with morning rain.,rain,"KDCA,72405013743,72403793728,F0198,KADW,KDAA,74594013705"
"Washington,DC,USA",7/28/21,92.8,75.3,83.1,93.6,75.3,83.9,64.8,56,0.4,100,4.17,rain,0,0,19.7,12.4,12.3,1015,40.4,9.8,73.8,6.3,5,,2021-07-28T06:05:54,2021-07-28T20:22:54,0.61,"Rain, Partially cloudy",Partly cloudy throughout the day with late afternoon rain.,rain,"KDCA,72405013743,72403793728,F0198,KADW,KDAA,74594013705"
"Washington,DC,USA",7/29/21,87.1,73.7,79.2,92.8,73.7,81.6,71.1,77.1,0.2,100,8.33,rain,0,0,23,14.1,198.6,1013.4,85.5,9.8,43.7,3.8,2,,2021-07-29T06:06:45,2021-07-29T20:21:58,0.66,"Rain, Partially cloudy",Partly cloudy throughout the day with rain.,rain,"KDCA,72405013743,72403793728,F0198,KADW,KDAA,74594013705"
"Washington,DC,USA",7/30/21,89.6,75.6,82.5,89.7,75.6,82.9,63.8,56.3,0,0,0,,0,0,25.7,15,321,1010.8,54.3,9.9,69.1,5.9,5,,2021-07-30T06:07:38,2021-07-30T20:21:00,0.7,Partially cloudy,Partly cloudy throughout the day.,partly-cloudy-day,"KDCA,72405013743,72403793728,F0198,KADW,KDAA,74594013705"
"Washington,DC,USA",7/31/21,80.8,69.6,74.7,81.2,69.6,74.7,57,54.5,0,0,0,,0,0,,11.9,84.9,1015.5,82.6,9.9,72.3,6.2,5,,2021-07-31T06:08:30,2021-07-31T20:20:01,0.75,Partially cloudy,Partly cloudy throughout the day.,partly-cloudy-day,"KDCA,72405013743,72403793728,F0198,KADW,KDAA,74594013705"
"Washington,DC,USA",8/1/21,80.5,70.8,74.4,82.9,70.8,74.5,67.3,79,0.41,100,25,rain,0,0,25.3,13.2,190.6,1011.7,92.2,9.3,31.6,3,1,,2021-08-01T06:09:23,2021-08-01T20:19:00,0.8,"Rain, Overcast",Cloudy skies throughout the day with a chance of rain throughout the day.,rain,"KDCA,72405013743,72403793728,F0198,KADW,KDAA,74594013705"
"Washington,DC,USA",8/2/21,82.5,66.4,73.9,81.9,66.4,73.9,58.1,59.6,0,0,0,,0,0,20.8,13.4,338.9,1016.3,38.5,9.9,52.5,4.5,3,,2021-08-02T06:10:16,2021-08-02T20:17:58,0.84,Partially cloudy,Becoming cloudy in the afternoon.,partly-cloudy-day,"KDCA,72405013743,72403793728,F0198,KADW,KDAA,74594013705"
"Washington,DC,USA",8/3/21,80.7,67.4,73.8,81,67.4,73.9,59.9,63.1,0,0,0,,0,0,,10.1,86.2,1019.1,86.3,9.9,48.4,4.1,2,,2021-08-03T06:11:09,2021-08-03T20:16:54,0.89,Partially cloudy,Partly cloudy throughout the day.,partly-cloudy-day,"KDCA,72405013743,72403793728,F0198,KADW,KDAA,74594013705"
"Washington,DC,USA",8/4/21,81.8,68.5,74.2,81.4,68.5,74.1,59.4,62,0,0,0,,0,0,24.2,13,53,1019.1,60.3,9.9,67.3,5.8,4,,2021-08-04T06:12:02,2021-08-04T20:15:49,0.93,Partially cloudy,Partly cloudy throughout the day.,partly-cloudy-day,"KDCA,72405013743,72403793728,F0198,KADW,KDAA,74594013705"
"Washington,DC,USA",8/5/21,86.9,66,76.3,85.9,66,76.2,59.9,59,0,0,0,,0,0,,9.9,208.8,1019.8,49.7,9.9,75.6,6.4,6,,2021-08-05T06:12:56,2021-08-05T20:14:43,0.96,Partially cloudy,Becoming cloudy in the afternoon.,partly-cloudy-day,"KDCA,72405013743,72403793728,F0198,KADW,KDAA,74594013705"
"Washington,DC,USA",8/6/21,89.7,70.4,79.5,90.2,70.4,80,64.1,61.4,0,0,0,,0,0,21.9,14.4,181.5,1021,70,9.9,74.6,6.4,6,,2021-08-06T06:13:50,2021-08-06T20:13:35,0.98,Partially cloudy,Becoming cloudy in the afternoon.,partly-cloudy-day,"KDCA,72405013743,72403793728,F0198,KADW,KDAA,74594013705"
"Washington,DC,USA",8/7/21,76.8,69.5,72.5,76.8,69.5,72.5,65.9,80,0.25,100,12.5,rain,0,0,,9.4,145.5,1018.5,92.1,9.8,24,2.1,1,,2021-08-07T06:14:44,2021-08-07T20:12:26,1,"Rain, Overcast",Cloudy skies throughout the day with afternoon rain.,rain,"KDCA,72405013743,72403793728,F0198,KADW,KDAA,74594013705"
"Washington,DC,USA",8/8/21,90.6,68.7,77.9,90.5,68.7,78.4,64.6,66.2,0,0,0,,0,0,,11.2,20,1017.8,50.9,9.8,80.2,6.9,6,,2021-08-08T06:15:38,2021-08-08T20:11:16,1,Partially cloudy,Partly cloudy throughout the day.,partly-cloudy-day,"KDCA,72405013743,72403793728,F0198,KADW,KDAA,74594013705"
"Washington,DC,USA",8/9/21,90.5,73.5,80.1,98.1,73.5,82.5,70.8,74.7,0.01,100,4.17,rain,0,0,23,15.7,155.5,1019.6,72.6,9.9,57.1,4.8,3,,2021-08-09T06:16:32,2021-08-09T20:10:05,0,"Rain, Partially cloudy",Partly cloudy throughout the day with late afternoon rain.,rain,"KDCA,72405013743,72403793728,F0198,KADW,KDAA,74594013705"
"Washington,DC,USA",8/10/21,92.9,75.8,81.7,103.1,75.8,84.5,72.1,74,0.61,100,8.33,rain,0,0,44.7,23.5,186.3,1019.2,54.5,9.8,65.6,5.6,5,,2021-08-10T06:17:26,2021-08-10T20:08:52,0.02,"Rain, Partially cloudy",Partly cloudy throughout the day with late afternoon rain.,rain,"KDCA,72405013743,72403793728,F0198,KADW,KDAA,74594013705"
"Washington,DC,USA",8/11/21,94.9,74.7,81.3,104.1,74.7,84.2,71.9,74.7,0.07,100,8.33,rain,0,0,34.4,12.6,200.5,1017.7,63.2,9.9,74.9,6.4,5,,2021-08-11T06:18:20,2021-08-11T20:07:38,0.05,"Rain, Partially cloudy",Becoming cloudy in the afternoon with late afternoon rain.,rain,"KDCA,72405013743,72403793728,F0198,KADW,KDAA,74594013705"
"Washington,DC,USA",8/12/21,96,73.7,83.8,104.1,73.7,89.1,72.7,71,0,0,0,,0,0,,15.4,185.1,1017.1,40.4,9.9,71.6,6.1,5,,2021-08-12T06:19:14,2021-08-12T20:06:23,0.09,Partially cloudy,Partly cloudy throughout the day.,partly-cloudy-day,"KDCA,72405013743,72403793728,F0198,KADW,KDAA,74594013705"
"Washington,DC,USA",8/13/21,96,74.7,84.7,102.5,74.7,89.4,71.2,66,0.1,100,16.67,rain,0,0,34.4,15.3,206.8,1018,78.2,9.9,67.2,5.8,5,,2021-08-13T06:20:09,2021-08-13T20:05:07,0.13,"Rain, Partially cloudy",Partly cloudy throughout the day with late afternoon rain.,rain,"KDCA,72405013743,72403793728,F0198,KADW,KDAA,74594013705"
"Washington,DC,USA",8/14/21,91.8,73.7,82.2,98.6,73.7,85.2,70.3,69.2,0,0,0,,0,0,17.2,10.1,317.7,1019,82.8,9.9,64.5,5.5,4,,2021-08-14T06:21:03,2021-08-14T20:03:50,0.19,Partially cloudy,Partly cloudy throughout the day.,partly-cloudy-day,"KDCA,72405013743,72403793728,F0198,KADW,KDAA,74594013705"
"Washington,DC,USA",8/15/21,82.7,72.8,77.3,83.8,72.8,77.6,65.2,67.6,2.47,100,29.17,rain,0,0,32.2,12.9,55.1,1021.6,92.1,9.3,52.9,4.5,3,,2021-08-15T06:21:57,2021-08-15T20:02:32,0.24,"Rain, Overcast",Cloudy skies throughout the day with rain clearing later.,rain,"KDCA,72405013743,72403793728,F0198,KADW,KDAA,74594013705"
"Washington,DC,USA",8/16/21,82.7,73.3,76.8,87.3,73.3,77.1,69.7,79.2,0.69,100,37.5,rain,0,0,21.9,9.9,126.7,1021,97.2,9.5,34.4,2.8,1,,2021-08-16T06:22:52,2021-08-16T20:01:12,0.3,"Rain, Overcast",Cloudy skies throughout the day with rain.,rain,"KDCA,72405013743,72403793728,F0198,KADW,KDAA,74594013705"
"Washington,DC,USA",8/17/21,87,72.8,80,96.2,72.8,83.6,72.9,79.9,0.62,100,16.67,rain,0,0,36.7,10,165.3,1020.5,89.6,9.6,40.1,3.4,1,,2021-08-17T06:23:46,2021-08-17T19:59:52,0.35,"Rain, Partially cloudy",Partly cloudy throughout the day with early morning rain.,rain,"KDCA,72405013743,72403793728,F0198,KADW,KDAA,74594013705"
"Washington,DC,USA",8/18/21,87,78.8,82.4,97.3,78.8,87.9,75.5,79.9,0.33,100,12.5,rain,0,0,30.8,20,169.6,1018.6,82.5,9.8,48.7,4.1,3,,2021-08-18T06:24:40,2021-08-18T19:58:31,0.4,"Rain, Partially cloudy",Partly cloudy throughout the day with rain.,rain,"KDCA,72405013743,72403793728,F0198,KADW,KDAA,74594013705"
"Washington,DC,USA",8/19/21,90.9,75.6,82.8,95.8,75.6,85.3,70.8,68.7,0.02,100,4.17,rain,0,0,20.8,12.9,257.9,1016.1,77.1,9.9,54.2,4.6,4,,2021-08-19T06:25:34,2021-08-19T19:57:08,0.44,"Rain, Partially cloudy",Partly cloudy throughout the day with late afternoon rain.,rain,"KDCA,72405013743,72403793728,F0198,KADW,KDAA,74594013705"
"Washington,DC,USA",8/20/21,83.5,71,77.3,86,71,77.8,69,76.7,2.14,100,37.5,rain,0,0,,13.1,30.6,1013.5,91.8,8.4,49.9,4.3,3,,2021-08-20T06:26:29,2021-08-20T19:55:45,0.48,"Rain, Overcast",Cloudy skies throughout the day with rain clearing later.,rain,"KDCA,72405013743,72403793728,F0198,KADW,KDAA,74594013705"
"Washington,DC,USA",8/21/21,85.7,74.4,79.9,90.1,74.4,81.7,69.6,71.4,0.11,100,8.33,rain,0,0,,9.5,24,1012.1,83.8,9.9,37.4,3.3,1,,2021-08-21T06:27:23,2021-08-21T19:54:21,0.49,"Rain, Partially cloudy",Partly cloudy throughout the day with afternoon rain.,rain,"KDCA,72405013743,72403793728,F0198,KADW,KDAA,74594013705"
"Washington,DC,USA",8/22/21,82.9,73.6,78.2,87.3,73.6,79.7,69.4,74.8,0.09,100,8.33,rain,0,0,42.5,8.7,270.8,1012.2,68.5,9.9,36.9,3.2,1,,2021-08-22T06:28:17,2021-08-22T19:52:57,0.5,"Rain, Partially cloudy",Partly cloudy throughout the day with rain in the morning and afternoon.,rain,"KDCA,72405013743,72403793728,F0198,KADW,KDAA,74594013705"
"Washington,DC,USA",8/23/21,92.7,73.7,83.3,97.1,73.7,85.9,68.7,63.5,0,0,0,,0,0,22.9,16.5,274.3,1011.5,66.2,9.8,63.7,5.4,4,,2021-08-23T06:29:11,2021-08-23T19:51:31,0.51,Partially cloudy,Partly cloudy throughout the day.,partly-cloudy-day,"KDCA,72405013743,72403793728,F0198,KADW,KDAA,74594013705"
"Washington,DC,USA",8/24/21,92.6,75.6,83.6,98.2,75.6,86.6,69.5,64.2,0.02,100,4.17,rain,0,0,,14.4,349.2,1015.4,47.4,9.8,70.9,6,5,,2021-08-24T06:30:05,2021-08-24T19:50:04,0.53,"Rain, Partially cloudy",Partly cloudy throughout the day with early morning rain.,rain,"KDCA,72405013743,72403793728,F0198,KADW,KDAA,74594013705"
"Washington,DC,USA",8/25/21,92.5,74.5,83,100.7,74.5,86.5,71.8,71.1,0.04,100,8.33,rain,0,0,19.7,9.8,188.5,1019,43.2,9.8,64.6,5.5,4,,2021-08-25T06:30:59,2021-08-25T19:48:37,0.55,"Rain, Partially cloudy",Partly cloudy throughout the day with late afternoon rain.,rain,"KDCA,72405013743,72403793728,F0198,KADW,KDAA,74594013705"
"Washington,DC,USA",8/26/21,90.2,75.5,80.3,100.2,75.5,83.2,71.9,76.1,0.52,100,16.67,rain,0,0,26.8,14.9,340.8,1019.8,80.7,8.9,67.7,5.9,6,,2021-08-26T06:31:53,2021-08-26T19:47:09,0.59,"Rain, Partially cloudy",Partly cloudy throughout the day with afternoon rain.,rain,"KDCA,72405013743,72403793728,F0198,KADW,KDAA,74594013705"
"Washington,DC,USA",8/27/21,91.2,75.3,80.7,101.1,75.3,83.4,73,78.3,0.29,100,12.5,rain,0,0,31.7,13.1,167.7,1018.9,56.6,9.1,53.1,4.6,6,,2021-08-27T06:32:47,2021-08-27T19:45:41,0.63,"Rain, Partially cloudy",Becoming cloudy in the afternoon with rain.,rain,"KDCA,72405013743,72403793728,F0198,KADW,KDAA,74594013705"
"Washington,DC,USA",8/28/21,90.7,75.5,81.8,99.5,75.5,85.2,72.4,74.4,0,0,0,,0,0,,14,38.9,1021.1,56.5,9,64.8,5.6,5,,2021-08-28T06:33:41,2021-08-28T19:44:12,0.67,Partially cloudy,Partly cloudy throughout the day.,partly-cloudy-day,"KDCA,72405013743,72403793728,F0198,KADW,KDAA,74594013705"
"Washington,DC,USA",8/29/21,82.9,72.9,77.7,86.9,72.9,78.8,69.5,76.7,0,0,0,,0,0,,10.8,68.4,1021.2,88.9,9.7,41.4,3.6,1,,2021-08-29T06:34:34,2021-08-29T19:42:42,0.72,Partially cloudy,Partly cloudy throughout the day.,partly-cloudy-day,"KDCA,72405013743,72403793728,F0198,KADW,KDAA,74594013705"
"Washington,DC,USA",8/30/21,92.6,74.4,80.6,99.8,74.4,83,71.3,74.7,0,0,0,,0,0,20.8,15.7,228.3,1013.6,63,9.1,68.5,5.9,7,,2021-08-30T06:35:28,2021-08-30T19:41:11,0.76,Partially cloudy,Partly cloudy throughout the day.,partly-cloudy-day,"KDCA,72405013743,72403793728,F0198,KADW,KDAA,74594013705"
"Washington,DC,USA",8/31/21,85.8,74.5,80.1,90.5,74.5,82.4,70.1,72.3,0,0,0,,0,0,,8.7,6.3,1010,79.1,9.6,30.4,2.7,1,,2021-08-31T06:36:22,2021-08-31T19:39:40,0.81,Partially cloudy,Partly cloudy throughout the day.,partly-cloudy-day,"KDCA,72405013743,72403793728,F0198,KADW,KDAA,74594013705"
"Washington,DC,USA",9/1/21,83.6,67.8,76.8,89.2,67.8,77.7,71.4,83.7,1.18,100,25,rain,0,0,40.3,24.2,216.2,1003.9,93,9.3,21.6,1.7,1,,2021-09-01T06:37:15,2021-09-01T19:38:08,0.86,"Rain, Overcast",Cloudy skies throughout the day with rain.,rain,"KDCA,72405013743,72403793728,F0198,KADW,KDAA,74594013705"
"Washington,DC,USA",9/2/21,78.9,62.8,71,78.9,62.8,71,52.7,54.6,0.1,100,4.17,rain,0,0,32.2,16.7,335.8,1012.5,25.7,9.9,71.1,6.1,9,,2021-09-02T06:38:09,2021-09-02T19:36:36,0.9,"Rain, Partially cloudy",Partly cloudy throughout the day with morning rain.,rain,"KDCA,72405013743,72403793728,F0198,KADW,KDAA,74594013705"
"Washington,DC,USA",9/3/21,78.8,58.4,69.3,78.8,58.4,69.3,52.9,57.5,0,0,0,,0,0,,9.9,339.5,1018.4,19.1,9.7,73.8,6.4,8,,2021-09-03T06:39:02,2021-09-03T19:35:04,0.94,Clear,Clear conditions throughout the day.,clear-day,"KDCA,72405013743,72403793728,F0198,KADW,KDAA,74594013705"
"Washington,DC,USA",9/4/21,79.8,62.2,70.4,79.8,62.2,70.4,58.5,67.4,0,0,0,,0,0,17.2,9.9,173,1017.4,53.9,9.9,65.2,5.6,6,,2021-09-04T06:39:56,2021-09-04T19:33:31,0.97,Partially cloudy,Partly cloudy throughout the day.,partly-cloudy-day,"KDCA,72405013743,72403793728,F0198,KADW,KDAA,74594013705"
"Washington,DC,USA",9/5/21,77.1,68.7,73,77.1,68.7,73,64.5,74.9,0,0,0,,0,0,,10,186.5,1011.4,85.7,9.9,27.5,2.3,1,,2021-09-05T06:40:49,2021-09-05T19:31:57,0.99,Partially cloudy,Partly cloudy throughout the day.,partly-cloudy-day,"KDCA,72405013743,72403793728,F0198,KADW,KDAA,74594013705"
"Washington,DC,USA",9/6/21,85.8,70.9,77.4,84.1,70.9,77,60.4,59.5,0.02,100,8.33,rain,0,0,23,15.5,289,1012,59.5,9.9,73.6,6.5,8,,2021-09-06T06:41:43,2021-09-06T19:30:23,1,"Rain, Partially cloudy",Partly cloudy throughout the day with early morning rain.,rain,"KDCA,72405013743,72403793728,F0198,KADW,KDAA,74594013705"
"Washington,DC,USA",9/7/21,85.8,65.3,74.8,84.7,65.3,74.8,61.1,64.3,0,0,0,,0,0,19.7,15.1,184.8,1015,32.1,9.9,60.6,5.3,6,,2021-09-07T06:42:36,2021-09-07T19:28:49,0,Partially cloudy,Partly cloudy throughout the day.,partly-cloudy-day,"KDCA,72405013743,72403793728,F0198,KADW,KDAA,74594013705"
"Washington,DC,USA",9/8/21,87,67.6,76.3,92.7,67.6,77.7,67.1,73.8,0,0,0,,0,0,19.7,14.7,184.8,1010.7,48.9,9.9,64.2,5.6,7,,2021-09-08T06:43:30,2021-09-08T19:27:14,0.01,Partially cloudy,Partly cloudy throughout the day.,partly-cloudy-day,"KDCA,72405013743,72403793728,F0198,KADW,KDAA,74594013705"
"Washington,DC,USA",9/9/21,78.7,68.8,72.8,78.7,68.8,72.8,63,72.5,0.25,100,8.33,rain,0,0,23,14.2,332.4,1009.5,87.5,9.5,27.9,2.3,1,,2021-09-09T06:44:23,2021-09-09T19:25:39,0.04,"Rain, Partially cloudy",Partly cloudy throughout the day with early morning rain.,rain,"KDCA,72405013743,72403793728,F0198,KADW,KDAA,74594013705"
"Washington,DC,USA",9/10/21,76.8,62.8,69.9,76.8,62.8,69.9,52.1,54.3,0,0,0,,0,0,30.4,16.9,316,1015.9,30,9.9,70.3,5.9,7,,2021-09-10T06:45:16,2021-09-10T19:24:04,0.07,Partially cloudy,Partly cloudy throughout the day.,partly-cloudy-day,"KDCA,72405013743,72403793728,F0198,KADW,KDAA,74594013705"
"Washington,DC,USA",9/11/21,79,60.2,69.7,79,60.2,69.7,56.7,64.6,0,0,0,,0,0,24.2,12.3,181.4,1022.1,44.9,9.9,48.8,4.2,3,,2021-09-11T06:46:10,2021-09-11T19:22:29,0.12,Partially cloudy,Partly cloudy throughout the day.,partly-cloudy-day,"KDCA,72405013743,72403793728,F0198,KADW,KDAA,74594013705"
"Washington,DC,USA",9/12/21,84.8,64.6,74.1,86.1,64.6,74.4,62.6,68.4,0,0,0,,0,0,25.3,17.8,192.4,1020.6,21.3,9.9,58.5,5,5,,2021-09-12T06:47:03,2021-09-12T19:20:53,0.17,Partially cloudy,Partly cloudy throughout the day.,partly-cloudy-day,"KDCA,72405013743,72403793728,F0198,KADW,KDAA,74594013705"
"Washington,DC,USA",9/13/21,89,70.5,79.7,91.9,70.5,80.5,66.6,66.4,0,0,0,,0,0,19.7,12.7,253.6,1018.9,52.6,9.6,60.7,5.2,5,,2021-09-13T06:47:57,2021-09-13T19:19:17,0.23,Partially cloudy,Clearing in the afternoon.,partly-cloudy-day,"KDCA,72405013743,72403793728,F0198,KADW,KDAA,74594013705"
"Washington,DC,USA",9/14/21,88.8,72.4,79.9,93.5,72.4,82,69.9,73,0,0,0,,0,0,,10,169.7,1017,70.4,8.9,56.5,4.9,4,,2021-09-14T06:48:50,2021-09-14T19:17:41,0.28,Partially cloudy,Partly cloudy throughout the day.,partly-cloudy-day,"KDCA,72405013743,72403793728,F0198,KADW,KDAA,74594013705"
"Washington,DC,USA",9/15/21,89.8,72.9,79.9,91,72.9,81.2,68,68.5,0,0,0,,0,0,26.4,17.7,189.7,1014.8,71,9.9,64.5,5.5,5,,2021-09-15T06:49:44,2021-09-15T19:16:05,0.34,Partially cloudy,Partly cloudy throughout the day.,partly-cloudy-day,"KDCA,72405013743,72403793728,F0198,KADW,KDAA,74594013705"
"Washington,DC,USA",9/16/21,82.8,72.8,75.7,86.8,72.8,76.2,67.7,76.8,0.77,100,25,rain,0,0,29.8,10,23.2,1019.5,92.9,9.5,31,2.7,2,,2021-09-16T06:50:38,2021-09-16T19:14:28,0.39,"Rain, Overcast",Cloudy skies throughout the day with rain.,rain,"KDCA,72405013743,72403793728,F0198,KADW,KDAA,74594013705"
"Washington,DC,USA",9/17/21,80.6,72.9,75.6,84,72.9,75.9,69.9,82.8,0.01,100,4.17,rain,0,0,,10.8,43.6,1021.3,87.1,9.3,29.4,2.5,1,,2021-09-17T06:51:31,2021-09-17T19:12:52,0.43,"Rain, Partially cloudy",Partly cloudy throughout the day with morning rain.,rain,"KDCA,72405013743,72403793728,F0198,KADW,KDAA,74594013705"
"Washington,DC,USA",9/18/21,84.8,70.5,75.9,89.4,70.5,77.1,69.5,81.4,0,0,0,,0,0,,7.9,131.7,1019,59.6,9.1,60.2,5.2,5,,2021-09-18T06:52:25,2021-09-18T19:11:15,0.47,Partially cloudy,Partly cloudy throughout the day.,partly-cloudy-day,"KDCA,72405013743,72403793728,F0198,KADW,KDAA,74594013705"
"Washington,DC,USA",9/19/21,82.8,70.9,75.8,83.9,70.9,76.1,63.1,66.2,0,0,0,,0,0,,12,25.5,1021,29,9.8,65,5.7,6,,2021-09-19T06:53:19,2021-09-19T19:09:39,0.49,Partially cloudy,Partly cloudy throughout the day.,partly-cloudy-day,"KDCA,72405013743,72403793728,F0198,KADW,KDAA,74594013705"
"Washington,DC,USA",9/20/21,79.8,63.5,71.5,79.8,63.5,71.5,59.2,66.5,0,0,0,,0,0,18.3,12.4,102.5,1025.1,65,9.9,59.9,5,6,,2021-09-20T06:54:13,2021-09-20T19:08:02,0.5,Partially cloudy,Partly cloudy throughout the day.,partly-cloudy-day,"KDCA,72405013743,72403793728,F0198,KADW,KDAA,74594013705"
"Washington,DC,USA",9/21/21,80.8,64.8,72.9,82.4,64.8,73.1,63,71.9,0,0,0,,0,0,,12.4,100.5,1024.3,79.6,9.9,28.4,2.5,1,,2021-09-21T06:55:07,2021-09-21T19:06:26,0.5,Partially cloudy,Partly cloudy throughout the day.,partly-cloudy-day,"KDCA,72405013743,72403793728,F0198,KADW,KDAA,74594013705"
"Washington,DC,USA",9/22/21,79.9,71.7,75.1,79.9,71.7,75.1,70.1,84.4,0.36,100,25,rain,0,0,41.4,20.2,146.9,1015.3,91.5,9.6,24.1,1.9,1,,2021-09-22T06:56:01,2021-09-22T19:04:49,0.52,"Rain, Overcast",Cloudy skies throughout the day with rain.,rain,"KDCA,72405013743,72403793728,F0198,KADW,KDAA,74594013705"
"Washington,DC,USA",9/23/21,75.7,61.8,70.2,75.7,61.8,70.2,60.6,72.9,1.21,100,29.17,rain,0,0,30.3,20.7,315.6,1011.2,89.6,8.4,47.9,4.1,4,,2021-09-23T06:56:56,2021-09-23T19:03:13,0.53,"Rain, Partially cloudy",Partly cloudy throughout the day with rain clearing later.,rain,"KDCA,72405013743,72403793728,F0198,KADW,KDAA,74594013705"
"Washington,DC,USA",9/24/21,74.7,55.5,65.2,74.7,55.5,65.2,48.3,56.8,0,0,0,,0,0,21.9,14.3,335.8,1018.5,21.1,9.9,78,6.7,6,,2021-09-24T06:57:50,2021-09-24T19:01:37,0.56,Partially cloudy,Partly cloudy throughout the day.,partly-cloudy-day,"KDCA,72405013743,72403793728,F0198,KADW,KDAA,74594013705"
"Washington,DC,USA",9/25/21,75.6,56.7,66,75.6,56.7,66,52.1,63.7,0,0,0,,0,0,,10.7,224.5,1016.9,44.9,9.9,55,4.7,3,,2021-09-25T06:58:45,2021-09-25T19:00:01,0.6,Partially cloudy,Becoming cloudy in the afternoon.,partly-cloudy-day,"KDCA,72405013743,72403793728,F0198,KDAA,KADW,74594013705"
"Washington,DC,USA",9/26/21,76.6,59.7,68,76.6,59.7,68,47.9,50.9,0,0,0,,0,0,25.7,17.9,296,1016.4,30.5,9.9,61,5.3,5,,2021-09-26T06:59:39,2021-09-26T18:58:25,0.64,Partially cloudy,Partly cloudy throughout the day.,partly-cloudy-day,"KDCA,72405013743,72403793728,F0198,KADW,KDAA,74594013705"
"Washington,DC,USA",9/27/21,79,57.3,67.9,79,57.3,67.9,53,60.6,0,0,0,,0,0,21.9,15.6,192.4,1016.5,23.4,9.9,81.3,6.9,7,,2021-09-27T07:00:34,2021-09-27T18:56:49,0.68,Partially cloudy,Partly cloudy throughout the day.,partly-cloudy-day,"KDCA,72405013743,72403793728,F0198,KADW,KDAA,74594013705"
"Washington,DC,USA",9/28/21,81.6,62.6,72.4,82.3,62.6,72.5,59.2,63.9,0,0,0,,0,0,,12.1,246.4,1012.5,53.6,9.9,30.5,2.8,1,,2021-09-28T07:01:30,2021-09-28T18:55:14,0.73,Partially cloudy,Partly cloudy throughout the day.,partly-cloudy-day,"KDCA,72405013743,72403793728,F0198,KADW,KDAA,74594013705"
"Washington,DC,USA",9/29/21,72.9,60.8,66.7,72.9,60.8,66.7,49.1,55.1,0,0,0,,0,0,19.7,15,356.9,1016.8,46.8,9.9,72.3,6.2,7,,2021-09-29T07:02:25,2021-09-29T18:53:38,0.77,Partially cloudy,Clearing in the afternoon.,partly-cloudy-day,"KDCA,72405013743,72403793728,F0198,KADW,KDAA,74594013705"
"Washington,DC,USA",9/30/21,74.7,55.4,64.7,74.7,55.4,64.7,49.1,59.2,0,0,0,,0,0,18.3,13.1,334.2,1020.4,24.6,9.9,67.2,5.8,6,,2021-09-30T07:03:21,2021-09-30T18:52:03,0.82,Partially cloudy,Partly cloudy throughout the day.,partly-cloudy-day,"KDCA,72405013743,72403793728,F0198,KADW,KDAA,74594013705"
"Washington,DC,USA",10/1/21,72.9,54.6,63.6,72.9,54.6,63.6,49.4,61.4,0,0,0,,0,0,,8.6,22.4,1024.6,25,9.9,72.5,6.2,7,,2021-10-01T07:04:16,2021-10-01T18:50:29,0.87,Partially cloudy,Partly cloudy throughout the day.,partly-cloudy-day,"KDCA,72405013743,72403793728,F0198,KADW,KDAA,74594013705"
"Washington,DC,USA",10/2/21,78.2,56.3,66.4,78.2,56.3,66.4,57.9,75.5,0,0,0,,0,0,,10.8,186.7,1021.7,53.1,9.9,60.6,5.2,4,,2021-10-02T07:05:13,2021-10-02T18:48:55,0.91,Partially cloudy,Partly cloudy throughout the day.,partly-cloudy-day,"KDCA,72405013743,72403793728,F0198,KADW,KDAA,74594013705"
"Washington,DC,USA",10/3/21,82.2,62.5,71.4,83.7,62.5,71.7,63.8,78.4,0,0,0,,0,0,,13.2,183.7,1015.5,65.5,8.7,66.4,5.7,6,,2021-10-03T07:06:09,2021-10-03T18:47:21,0.95,Partially cloudy,Partly cloudy throughout the day.,partly-cloudy-day,"KDCA,72405013743,72403793728,F0198,KADW,KDAA,74594013705"
"Washington,DC,USA",10/4/21,82.2,69.9,74.8,83.9,69.9,75.2,65.5,73.4,0,0,0,,0,0,,10.9,182.8,1014,83.2,9.9,58.4,5.3,6,,2021-10-04T07:07:05,2021-10-04T18:45:47,0.98,Partially cloudy,Partly cloudy throughout the day.,partly-cloudy-day,"KDCA,72405013743,72403793728,F0198,KADW,KDAA,74594013705"
"Washington,DC,USA",10/5/21,82.8,68.6,73.2,85,68.6,73.6,66.4,80.2,0,0,0,,0,0,,16.6,60.3,1020.7,76.2,9.3,59,5.1,5,,2021-10-05T07:08:02,2021-10-05T18:44:14,1,Partially cloudy,Partly cloudy throughout the day.,partly-cloudy-day,"KDCA,72405013743,72403793728,F0198,KADW,KDAA,74594013705"
"Washington,DC,USA",10/6/21,71.8,67.6,69.7,71.8,67.6,69.7,65,85.1,0.02,100,8.33,rain,0,0,,10,69.6,1026.7,97.9,8,14.9,1.4,1,,2021-10-06T07:08:59,2021-10-06T18:42:42,0,"Rain, Overcast",Cloudy skies throughout the day with morning rain.,rain,"KDCA,72405013743,72403793728,F0198,KADW,KDAA,74594013705"
"Washington,DC,USA",10/7/21,78.6,64.8,70,78.6,64.8,70,61.2,74.6,0,0,0,,0,0,,7.6,83.4,1025.2,85.6,9.9,49.2,4.2,6,,2021-10-07T07:09:57,2021-10-07T18:41:10,0.01,Partially cloudy,Partly cloudy throughout the day.,partly-cloudy-day,"KDCA,72405013743,72403793728,F0198,KADW,KDAA,74594013705"
"Washington,DC,USA",10/8/21,77,66,70.9,77,66,70.9,61.4,73.1,0,0,0,,0,0,,7.8,130.4,1020.7,84.8,9.9,22.2,2,1,,2021-10-08T07:10:54,2021-10-08T18:39:39,0.03,Partially cloudy,Partly cloudy throughout the day.,partly-cloudy-day,"KDCA,72405013743,72403793728,F0198,KADW,KDAA,74594013705"
"Washington,DC,USA",10/9/21,73.1,64.7,69,73.1,64.7,69,60.6,75,0,0,0,,0,0,18.3,13.3,59.2,1020.2,92.1,9.9,24.8,2.2,1,,2021-10-09T07:11:52,2021-10-09T18:38:08,0.06,Overcast,Cloudy skies throughout the day.,cloudy,"KDCA,72405013743,72403793728,F0198,KADW,KDAA,74594013705"
"Washington,DC,USA",10/10/21,72.9,64.9,68.6,72.9,64.9,68.6,62.7,82,0.04,100,12.5,rain,0,0,,16.1,32.5,1018.4,99.1,8.7,18.1,1.6,1,,2021-10-10T07:12:51,2021-10-10T18:36:38,0.11,"Rain, Overcast",Cloudy skies throughout the day with rain.,rain,"KDCA,72405013743,72403793728,F0198,KADW,KDAA,74594013705"
"Washington,DC,USA",10/11/21,68.9,64.8,67.1,68.9,64.8,67.1,60.2,78.8,0,0,0,,0,0,,13.2,12.2,1018,98.9,9.7,12.1,1,1,,2021-10-11T07:13:49,2021-10-11T18:35:08,0.16,Overcast,Cloudy skies throughout the day.,cloudy,"KDCA,72405013743,72403793728,F0198,KADW,KDAA,74594013705"
"Washington,DC,USA",10/12/21,71.7,64,67.5,71.7,64,67.5,62,82.8,0.05,100,4.17,rain,0,0,,8.8,30.4,1018.7,98.3,8.8,18,1.4,1,,2021-10-12T07:14:48,2021-10-12T18:33:39,0.21,"Rain, Overcast",Cloudy skies throughout the day with late afternoon rain.,rain,"KDCA,72405013743,72403793728,F0198,KADW,KDAA,74594013705"
"Washington,DC,USA",10/13/21,73.8,65.7,69.1,73.8,65.7,69.1,63.7,83.1,0,0,0,,0,0,,7.8,182.1,1017.3,92.1,9.3,23.8,1.8,1,,2021-10-13T07:15:47,2021-10-13T18:32:11,0.27,Overcast,Cloudy skies throughout the day.,cloudy,"KDCA,72405013743,72403793728,F0198,KADW,KDAA,74594013705"
"Washington,DC,USA",10/14/21,80.7,62,70.5,81.2,62,70.6,60,72.2,0,0,0,,0,0,19.7,9.1,332.5,1015.4,60.2,9,68.7,5.8,5,,2021-10-14T07:16:47,2021-10-14T18:30:43,0.33,Partially cloudy,Partly cloudy throughout the day.,partly-cloudy-day,"KDCA,72405013743,72403793728,F0198,KDAA,KADW,74594013705"
"Washington,DC,USA",10/15/21,80.1,64.2,70.6,81.8,64.2,70.6,62.5,76.5,0,0,0,,0,0,,9,187.6,1013.6,66.5,9.9,68.7,5.9,6,,2021-10-15T07:17:47,2021-10-15T18:29:17,0.37,Partially cloudy,Partly cloudy throughout the day.,partly-cloudy-day,"KDCA,72405013743,72403793728,F0198,KADW,KDAA,74594013705"
"Washington,DC,USA",10/16/21,80.8,58.6,68,82.7,58.6,68.1,59.5,74.7,0.3,100,12.5,rain,0,0,33,18.2,223.9,1008.7,69,9.3,29.4,2.4,2,,2021-10-16T07:18:47,2021-10-16T18:27:51,0.42,"Rain, Partially cloudy",Partly cloudy throughout the day with rain.,rain,"KDCA,72405013743,72403793728,F0198,KADW,KDAA,74594013705"
"Washington,DC,USA",10/17/21,64.8,52.6,58.1,64.8,52.6,58.1,40.2,52.8,0,0,0,,0,0,31.8,19.2,293.8,1014.5,47.4,9.9,35.5,3.1,3,,2021-10-17T07:19:48,2021-10-17T18:26:26,0.45,Partially cloudy,Becoming cloudy in the afternoon.,partly-cloudy-day,"KDCA,72405013743,72403793728,F0198,KADW,KDAA,74594013705"
"Washington,DC,USA",10/18/21,69,47.5,58,69,43.9,57.6,38.6,50.5,0,0,0,,0,0,32,20.6,292.1,1016.1,22,9.9,84.8,7.4,7,,2021-10-18T07:20:49,2021-10-18T18:25:02,0.48,Partially cloudy,Partly cloudy throughout the day.,partly-cloudy-day,"KDCA,72405013743,72403793728,F0198,KADW,KDAA,74594013705"
"Washington,DC,USA",10/19/21,73.8,47.2,60.2,73.8,44.9,60.1,41.7,52.7,0,0,0,,0,0,24.2,13.2,263.2,1020,0,9.9,81.9,7.1,7,,2021-10-19T07:21:50,2021-10-19T18:23:39,0.49,Clear,Clear conditions throughout the day.,clear-day,"KDCA,72405013743,72403793728,F0198,KADW,KDAA,74594013705"
"Washington,DC,USA",10/20/21,76.9,53.9,64.9,76.9,53.9,64.9,47.4,55.9,0,0,0,,0,0,19.7,12.8,246.3,1020.2,20,9.9,81.5,7.2,7,,2021-10-20T07:22:51,2021-10-20T18:22:16,0.5,Clear,Clearing in the afternoon.,clear-day,"KDCA,72405013743,72403793728,F0198,KADW,KDAA,74594013705"
"Washington,DC,USA",10/21/21,74,52.4,63.7,74,52.4,63.7,52.5,68.8,0,0,0,,0,0,20.8,11.6,187.3,1015.9,27.7,9.9,78.1,6.7,7,,2021-10-21T07:23:53,2021-10-21T18:20:55,0.51,Partially cloudy,Clearing in the afternoon.,partly-cloudy-day,"KDCA,72405013743,72403793728,F0198,KADW,KDAA,74594013705"
"Washington,DC,USA",10/22/21,69.8,58.5,65.4,69.8,58.5,65.4,49.1,56.3,0,0,0,,0,0,21.9,13.7,304.4,1013.4,64.7,9.9,62.2,5.3,6,,2021-10-22T07:24:56,2021-10-22T18:19:35,0.52,Partially cloudy,Partly cloudy throughout the day.,partly-cloudy-day,"KDCA,72405013743,72403793728,F0198,KADW,KDAA,74594013705"
"Washington,DC,USA",10/23/21,67.7,54.6,60.6,67.7,54.6,60.6,47.4,62.6,0,0,0,,0,0,23,11.1,312.1,1015.6,78,9.9,40.3,3.6,3,,2021-10-23T07:25:58,2021-10-23T18:18:15,0.54,Partially cloudy,Partly cloudy throughout the day.,partly-cloudy-day,"KDCA,72405013743,72403793728,F0198,KADW,KDAA,74594013705"
"Washington,DC,USA",10/24/21,69.9,54.6,61.2,69.9,54.6,61.2,49.4,65.5,0,0,0,,0,0,,11.1,158.6,1019.9,80.4,9.9,68.2,6,4,,2021-10-24T07:27:01,2021-10-24T18:16:57,0.57,Partially cloudy,Partly cloudy throughout the day.,partly-cloudy-day,"KDCA,72405013743,72403793728,F0198,KADW,KDAA,74594013705"
"Washington,DC,USA",10/25/21,79.9,61.8,67.5,79.9,61.8,67.5,59.1,75.7,1.31,100,25,rain,0,0,45.9,14.4,186.9,1011.7,85.3,8.9,66.8,5.8,6,,2021-10-25T07:28:05,2021-10-25T18:15:40,0.61,"Rain, Partially cloudy",Partly cloudy throughout the day with late afternoon rain.,rain,"KDCA,72405013743,72403793728,F0198,KADW,KDAA,74594013705"
"Washington,DC,USA",10/26/21,65.8,53.8,60.1,65.8,53.8,60.1,48.7,67.9,0.31,100,12.5,rain,0,0,42.6,25.6,309.2,1002.2,85.2,9.7,69.3,6,5,,2021-10-26T07:29:08,2021-10-26T18:14:24,0.65,"Rain, Partially cloudy",Partly cloudy throughout the day with early morning rain.,rain,"KDCA,72405013743,72403793728,F0198,KADW,KDAA,74594013705"
"Washington,DC,USA",10/27/21,70.9,52.9,60.4,70.9,52.9,60.4,46.6,61,0,0,0,,0,0,33.8,21.4,325.7,1007.7,53.1,9.9,76.1,6.6,6,,2021-10-27T07:30:12,2021-10-27T18:13:10,0.69,Partially cloudy,Clearing in the afternoon.,partly-cloudy-day,"KDCA,72405013743,72403793728,F0198,KADW,KDAA,74594013705"
"Washington,DC,USA",10/28/21,67.7,51.5,59.2,67.7,51.5,59.2,49.5,70.8,0,0,0,,0,0,,11.1,116.1,1012.6,60.5,9.9,44.8,3.9,3,,2021-10-28T07:31:17,2021-10-28T18:11:56,0.74,Partially cloudy,Partly cloudy throughout the day.,partly-cloudy-day,"KDCA,72405013743,72403793728,F0198,KADW,KDAA,74594013705"
"Washington,DC,USA",10/29/21,61.9,56.8,59.4,61.9,56.8,59.4,55.3,86.5,1.23,100,62.5,rain,0,0,36.9,21.5,76,1002.4,99.8,6.8,6.8,0.6,0,,2021-10-29T07:32:21,2021-10-29T18:10:44,0.79,"Rain, Overcast",Cloudy skies throughout the day with a chance of rain throughout the day.,rain,"KDCA,72405013743,72403793728,F0198,KADW,KDAA,74594013705"
"Washington,DC,USA",10/30/21,62.7,55.7,59,62.7,55.7,59,51.9,77.8,0.06,100,12.5,rain,0,0,,14.4,192.3,1000.8,91.1,9.4,24.5,2.1,1,,2021-10-30T07:33:26,2021-10-30T18:09:33,0.84,"Rain, Overcast",Cloudy skies throughout the day with rain.,rain,"KDCA,72405013743,72403793728,F0198,KADW,KDAA,74594013705"
"Washington,DC,USA",10/31/21,67.8,52,58.4,67.8,52,58.4,48.7,72.1,0,0,0,,0,0,28.3,16.9,267.5,1006.2,69.8,9.7,46.8,4.1,3,,2021-10-31T07:34:31,2021-10-31T18:08:24,0.88,Partially cloudy,Partly cloudy throughout the day.,partly-cloudy-day,"KDCA,72405013743,72403793728,F0198,KADW,KDAA,74594013705"
"Washington,DC,USA",11/1/21,61.9,50.2,56.2,61.9,50.2,56.2,38.9,54.6,0,0,0,,0,0,24.2,16.6,285.5,1020.1,34.1,9.9,87.2,7.7,6,,2021-11-01T07:35:37,2021-11-01T18:07:16,0.93,Partially cloudy,Partly cloudy throughout the day.,partly-cloudy-day,"KDCA,72405013743,72403793728,F0198,KADW,KDAA,74594013705"
"Washington,DC,USA",11/2/21,51.6,45.7,48.8,51.6,43.5,47.4,41.6,76.3,0.11,100,25,rain,0,0,,12,332.5,1024.5,87.9,9.8,15.5,1.3,1,,2021-11-02T07:36:42,2021-11-02T18:06:09,0.96,"Rain, Partially cloudy",Partly cloudy throughout the day with rain in the morning and afternoon.,rain,"KDCA,72405013743,72403793728,F0198,KADW,KDAA,74594013705"
"Washington,DC,USA",11/3/21,52.9,37.8,45.9,52.9,36,43.8,31.5,59.9,0,0,0,,0,0,20.8,14.8,328.5,1026.8,37.7,9.9,78.2,6.7,6,,2021-11-03T07:37:48,2021-11-03T18:05:03,0.99,Partially cloudy,Partly cloudy throughout the day.,partly-cloudy-day,"KDCA,72405013743,72403793728,F0198,KADW,KDAA,74594013705"
"Washington,DC,USA",11/4/21,53.6,38.5,45.6,53.6,33.7,43.9,31.2,58.6,0,0,0,,0,0,,6.5,20.3,1027,83.2,9.9,46,3.9,3,,2021-11-04T07:38:54,2021-11-04T18:04:00,1,Partially cloudy,Partly cloudy throughout the day.,partly-cloudy-day,"KDCA,72405013743,72403793728,F0198,KADW,KDAA,74594013705"
"Washington,DC,USA",11/5/21,55,35.3,44.9,55,29.2,42.6,28.5,55.1,0,0,0,,0,0,,12.3,0.3,1028.2,50,9.9,74.7,6.2,6,,2021-11-05T07:40:00,2021-11-05T18:02:57,0,Partially cloudy,Partly cloudy throughout the day.,partly-cloudy-day,"KDCA,72405013743,72403793728,F0198,KADW,KDAA,74594013705"
"Washington,DC,USA",11/6/21,56.8,33.9,45.4,56.8,27.3,43,32.5,62.5,0,0,0,,0,0,,11.3,26.5,1028.1,72.7,9.9,73,6.2,5,,2021-11-06T07:41:07,2021-11-06T18:01:56,0.02,Partially cloudy,Partly cloudy throughout the day.,partly-cloudy-day,"KDCA,72405013743,72403793728,F0198,KADW,KDAA,74594013705"
"Washington,DC,USA",11/7/21,59.8,38.6,48.1,59.8,33.5,45.7,33.6,60,0,0,0,,0,0,,12.2,4.6,1022.4,73.8,9.9,72.3,6.4,6,,2021-11-07T06:42:13,2021-11-07T17:00:57,0.05,Partially cloudy,Partly cloudy throughout the day.,partly-cloudy-day,"KDCA,72405013743,72403793728,F0198,KADW,KDAA,74594013705"
"Washington,DC,USA",11/8/21,69.9,43.2,54.6,69.9,38.2,53.1,38.3,56.1,0,0,0,,0,0,17.2,12.3,336.6,1021.9,16.1,9.9,72,6.2,6,,2021-11-08T06:43:20,2021-11-08T16:59:59,0.09,Clear,Clear conditions throughout the day.,clear-day,"KDCA,72405013743,72403793728,F0198,KADW,KDAA,74594013705"
"Washington,DC,USA",11/9/21,71.4,42.7,55.7,71.4,42.7,55.6,42.8,65.6,0,0,0,,0,0,,9.7,196.6,1020.9,21,9.9,71.4,6.2,6,,2021-11-09T06:44:27,2021-11-09T16:59:03,0.14,Partially cloudy,Partly cloudy throughout the day.,partly-cloudy-day,"KDCA,72405013743,72403793728,F0198,KADW,KDAA,74594013705"
"Washington,DC,USA",11/10/21,72,49.3,59.9,72,48.7,59.9,45.8,62.7,0,0,0,,0,0,,14.5,313.6,1020.1,32.1,9.9,72.2,6.2,5,,2021-11-10T06:45:34,2021-11-10T16:58:09,0.19,Partially cloudy,Clearing in the afternoon.,partly-cloudy-day,"KDCA,72405013743,72403793728,F0198,KADW,KDAA,74594013705"
"Washington,DC,USA",11/11/21,68,47.5,57.8,68,44,57.1,50,75.8,0,0,0,,0,0,,14.8,119.8,1021.4,62,9.5,48.2,4,3,,2021-11-11T06:46:41,2021-11-11T16:57:16,0.25,Partially cloudy,Partly cloudy throughout the day.,partly-cloudy-day,"KDCA,72405013743,72403793728,F0198,KADW,KDAA,74594013705"
"Washington,DC,USA",11/12/21,64.9,50.3,59.4,64.9,50.3,59.4,48.1,68.5,0.6,100,33.33,rain,0,0,29.7,16,221.1,1014.1,58.4,8.9,62.2,5.3,6,,2021-11-12T06:47:48,2021-11-12T16:56:25,0.3,"Rain, Partially cloudy",Partly cloudy throughout the day with rain clearing later.,rain,"KDCA,72405013743,72403793728,F0198,KADW,KDAA,74594013705"
"Washington,DC,USA",11/13/21,53,39.5,47.9,53,35.5,45.9,35.3,63.7,0.01,100,4.17,rain,0,0,33.8,16.8,284.6,1012.1,42,9.8,43.4,3.7,4,,2021-11-13T06:48:54,2021-11-13T16:55:36,0.35,"Rain, Partially cloudy",Partly cloudy throughout the day with afternoon rain.,rain,"KDCA,72405013743,72403793728,F0198,KADW,KDAA,74594013705"
"Washington,DC,USA",11/14/21,47.8,33.6,42.4,43.7,27.6,37.8,28.3,58.5,0,0,0,,0,0,23.8,13.9,204.6,1014.2,66.4,9.9,41.6,3.7,4,,2021-11-14T06:50:01,2021-11-14T16:54:49,0.4,Partially cloudy,Partly cloudy throughout the day.,partly-cloudy-day,"KDCA,72405013743,72403793728,F0198,KADW,KDAA,74594013705"
"Washington,DC,USA",11/15/21,51.1,39.8,45.5,51.1,35.1,40.9,26.3,47.6,0,0,0,,0,0,33.5,20.3,282.9,1015.4,65.7,9.9,49.4,4.2,3,,2021-11-15T06:51:08,2021-11-15T16:54:03,0.43,Partially cloudy,Partly cloudy throughout the day.,partly-cloudy-day,"KDCA,72405013743,72403793728,F0198,KADW,KDAA,74594013705"
"Washington,DC,USA",11/16/21,53.9,36.8,45.3,53.9,32.3,43.4,29.6,54.9,0,0,0,,0,0,,8.8,212.3,1023,63.8,9.9,82.7,7.3,5,,2021-11-16T06:52:14,2021-11-16T16:53:20,0.46,Partially cloudy,Partly cloudy throughout the day.,partly-cloudy-day,"KDCA,72405013743,72403793728,F0198,KADW,KDAA,74594013705"
"Washington,DC,USA",11/17/21,64.1,39.7,50.2,64.1,35.6,49.3,40.6,71.2,0,0,0,,0,0,,9.2,155.2,1023.1,48.9,9.9,76.1,6.5,5,,2021-11-17T06:53:21,2021-11-17T16:52:38,0.48,Partially cloudy,Clearing in the afternoon.,partly-cloudy-day,"KDCA,72405013743,72403793728,F0198,KADW,KDAA,74594013705"
"Washington,DC,USA",11/18/21,74,48.7,60.2,74,41.8,59.8,45.3,59.9,0.06,100,12.5,rain,0,0,38.2,21.2,224.6,1017.8,49.2,9.9,79,6.6,5,,2021-11-18T06:54:27,2021-11-18T16:51:58,0.5,"Rain, Partially cloudy",Becoming cloudy in the afternoon with late afternoon rain.,rain,"KDCA,72405013743,72403793728,F0198,KADW,KDAA,74594013705"
"Washington,DC,USA",11/19/21,47.8,38.4,43.9,42,32.3,37.4,22,42,0,0,0,,0,0,33.8,22.5,323.2,1028.9,30,9.9,87.5,7.4,6,,2021-11-19T06:55:32,2021-11-19T16:51:20,0.5,Partially cloudy,Partly cloudy throughout the day.,partly-cloudy-day,"KDCA,72405013743,72403793728,F0198,KADW,KDAA,74594013705"
"Washington,DC,USA",11/20/21,48.7,32.4,40.5,45,27.4,37.7,26.8,58.7,0,0,0,,0,0,,10.9,208,1033.6,57.8,9.9,43.7,3.8,2,,2021-11-20T06:56:38,2021-11-20T16:50:44,0.51,Partially cloudy,Partly cloudy throughout the day.,partly-cloudy-day,"KDCA,72405013743,72403793728,F0198,KADW,KDAA,74594013705"
"Washington,DC,USA",11/21/21,53,37.4,45.8,53,34.7,44.6,36.5,71.4,0,0,0,,0,0,,10.2,198,1023.9,81.6,9.9,28.2,2.3,2,,2021-11-21T06:57:43,2021-11-21T16:50:10,0.52,Partially cloudy,Partly cloudy throughout the day.,partly-cloudy-day,"KDCA,72405013743,72403793728,F0198,KADW,KDAA,74594013705"
"Washington,DC,USA",11/22/21,53.1,37.9,47.3,53.1,28.9,43.8,33.8,61.6,0.07,100,20.83,rain,0,0,34.4,21.9,328.1,1014.2,84.6,9.9,27.7,2.3,2,,2021-11-22T06:58:48,2021-11-22T16:49:38,0.54,"Rain, Partially cloudy",Partly cloudy throughout the day with rain clearing later.,rain,"KDCA,72405013743,72403793728,F0198,KADW,KDAA,74594013705"
"Washington,DC,USA",11/23/21,44.8,33,38.4,37.4,24.4,31.2,16.9,41.8,0,0,0,,0,0,29.8,17.2,314.8,1021.1,31.9,9.9,77.5,6.6,5,,2021-11-23T06:59:52,2021-11-23T16:49:08,0.57,Partially cloudy,Becoming cloudy in the afternoon.,partly-cloudy-day,"KDCA,72405013743,72403793728,F0198,KADW,KDAA,74594013705"
"Washington,DC,USA",11/24/21,48.7,30.3,39.5,47.7,24.5,36.5,20.4,47,0,0,0,,0,0,,9.6,266.8,1028.6,29,9.9,84.4,7.3,5,,2021-11-24T07:00:56,2021-11-24T16:48:40,0.61,Partially cloudy,Partly cloudy throughout the day.,partly-cloudy-day,"KDCA,72405013743,72403793728,F0198,KADW,KDAA,74594013705"
"Washington,DC,USA",11/25/21,57.1,34.6,44.6,57.1,29.7,42.6,29.3,56.2,0,0,0,,0,0,,8.7,197.7,1018.5,79.6,9.9,53.5,4.5,3,,2021-11-25T07:01:59,2021-11-25T16:48:14,0.66,Partially cloudy,Partly cloudy throughout the day.,partly-cloudy-day,"KDCA,72405013743,72403793728,F0198,KADW,KDAA,74594013705"
"Washington,DC,USA",11/26/21,48.5,35.7,43.1,46.7,26.8,36.5,27.9,57.6,0.09,100,12.5,rain,0,0,41.8,23.7,298.6,1011.3,78.7,9.6,77,6.7,5,,2021-11-26T07:03:02,2021-11-26T16:47:50,0.7,"Rain, Partially cloudy",Partly cloudy throughout the day with early morning rain.,rain,"KDCA,72405013743,72403793728,F0198,KADW,KDAA,74594013705"
"Washington,DC,USA",11/27/21,44.7,33.8,39,40.2,23.8,32.5,18.7,44,0,0,0,,0,0,28.3,16.4,297.8,1016.2,70.7,9.9,78.1,6.9,5,,2021-11-27T07:04:04,2021-11-27T16:47:28,0.75,Partially cloudy,Partly cloudy throughout the day.,partly-cloudy-day,"KDCA,72405013743,72403793728,F0198,KADW,KDAA,74594013705"
"Washington,DC,USA",11/28/21,55.3,37.3,45.9,55.3,34.3,43.4,28.9,52.1,0,0,0,,0,0,18.3,11.1,120.4,1011.2,67.4,9.9,77.2,6.7,5,,2021-11-28T07:05:05,2021-11-28T16:47:09,0.81,Partially cloudy,Becoming cloudy in the afternoon.,partly-cloudy-day,"KDCA,72405013743,72403793728,F0198,KADW,KDAA,74594013705"
"Washington,DC,USA",11/29/21,46.8,34.3,41.6,41.2,30.3,35.5,22.2,46.2,0,0,0,,0,0,35,21.7,320.1,1016.1,55.5,9.9,39.4,3.4,3,,2021-11-29T07:06:06,2021-11-29T16:46:51,0.86,Partially cloudy,Becoming cloudy in the afternoon.,partly-cloudy-day,"KDCA,72405013743,72403793728,F0198,KADW,KDAA,74594013705"
